username,rating,content,ip_address,time
Jason_日月星辰,5.0,住金沙建议选择在57层spago吃早餐，边吃早餐边欣赏风景，非常的享受，早餐之后再去花园散步，真爽啊,N/A,03/05/2019
M22****966,5.0,夜明很美，自由行那天去的，去的路上还是很曲折的，但值得体验，金沙～滨海花园～摩天轮等一目了然。看图吧,N/A,10/08/2018
_szai****2983,5.0,如果已经在金沙购物中心购物，就顺路上空中花园观景。约五点多上去，看着华灯初上，都不用坐摩天轮观景了。,N/A,31/07/2018
M65****48,4.3,金沙空中花园位于金沙酒店的顶层，是是吧酒店的三栋大厦连起来后形成的巨大顶层，上面还建有著名的无边游泳池。建议带孩子的各位在金沙酒店入住一晚。,N/A,19/11/2017
蛉啊子,3.7,位于新加坡滨海湾金沙酒店的楼顶，景色无限好，可以从高空中尽情欣赏新加坡滨海湾的风光，只是不能进入金沙酒店的无边游泳池，泳池是不对外售票的。。,N/A,06/07/2016
M22****3363,4.0,滨海湾金沙建筑非常特别，很时尚也具有设计美感，空中花园像一个横跨在三座大楼顶部的船，犹如扬帆起航，空中花园种植了很多树木还有植物，非常美。,N/A,01/03/2020
XXX-Trip,5.0,来到了新加坡，无论预算多不多，都应该来一下金沙酒店，这里作为新加坡的地标，无论是白天还是晚上，看出去的景色都格外漂亮，尤其是夜景，流光溢彩,N/A,02/07/2017
15****382,5.0,它是由三栋高大上的建筑组成，有一条空中长廊联通金沙酒店。房间价格很贵，听说4年后已经赚钱啦！,N/A,26/12/2015
hw9586,5.0,很壮观，在酒店顶层，酒店住户凭房卡免费参观，旁边就是无边泳池，可以俯瞰下面的滨海湾花园，晚上可以欣赏灿烂的夜景，还可以点杯饮料细细品味新加坡的精华之处,N/A,22/02/2016
M40****008,5.0,坐地铁去空中花园要在购物中心里绕，有一点点小远，上去之后能尽览新加坡夜景，晚风习习很舒适,N/A,12/10/2018
_WeCh****907123,5.0,景色不错，但是以为可以上金沙的顶楼，可是只是顶楼下面一层的走廊。也就是可以看周围的全景。,N/A,28/04/2018
eege,4.3,这个其实和摩天轮类似，都是站在高处俯瞰新加坡市中心，如果订了这个可以考虑不去摩天轮。票价还好，就是去不了57层的游泳池有点遗憾。,N/A,11/02/2018
吃苹果的麻雀呀,4.7,位于号称当今世上最昂贵的酒店——金沙酒店顶层，可以俯瞰新加坡的城市景观。举目远眺，无论明媚阳光下的碧蓝海水，还是静谧夜空下的Spectra水幕灯光秀的盛景，高空观景台是很好的观景台。,N/A,07/10/2020
135****3021,5.0,百度给的地点位置实在有点……呵呵，经历大汗淋漓的寻找后，终于上到了56层，看到整个新加坡市中心区域和滨海区域（无边泳池在57层，其实在56层可以去到餐厅，在餐厅边缘可以看到无边泳池）,N/A,09/02/2019
一枚篮子,3.7,额怎么说呢就是一个去不去都后悔的地方   只有一坨地方可以参观 大部分都只对酒店住客开放  真的就只能上去看看也没觉得多震撼……还行吧,N/A,20/07/2017
东京浪人,4.3,虽然是人工建造的旅游建筑，但是很有特色。规模较大，值得一游。只是当地气温较高，又是露天式的园林，建议可以帶遮阳伞或遮阳帽。,N/A,03/09/2016
小思文,3.7,滨海湾金沙空中花园也是蛮有趣的，这里的很多的设备也是蛮有趣的，空中花园的很多的东西都都可以参观的，金沙空中花园也很独特的风格的哦，好多的好看的东西也是比较值得。,N/A,23/05/2020
M34****678,5.0,金沙空中花园的风景不错，但是游客也很多。【观景诀窍】酒吧点单，不让从进来的门走，我们误打误撞走进酒店一片人少，视角更好的观景地带。只有入住酒店才能进入的，所以去酒吧点个单也算有点小福利了。就在无边泳池入口旁！图1为一般游客视角，图2是人少那片区域。,N/A,11/04/2018
vivi,5.0,于新加坡乌节路上的这座住宅楼名为&amp;quot;天空花园&amp;quot;（SkyPark）。它以创新型的&amp;quot;空中花园&amp;quot;在其他高层住宅楼中独树一帜。尽管场地极其狭小，但实现了开发商所期待的密度和效率，同时不失宽大的空间感。底层设置了一圈池塘和郁郁葱葱的景观区域。利用绿地和幕墙以及悬垂出来的一座体育馆，空间感和空间的深度得以表现出来。,N/A,04/02/2017
e01****90,4.3,Tower1顶部的无边泳池只供入住酒店的客人免费使用。普通游客只能付费到Tower3顶部的观光区域（空中花园）游览。（花园和无边泳池的出入口并不一致。）从下面看空中花园也是如此惊叹，是因为地少么，花园都建在楼顶了,N/A,22/01/2016
牡丹,4.0,金沙空中花园在新加坡金沙综合娱乐城，造型有如一个巨大的冲浪板横跨在三幢楼的顶端。距离地面大约有200多米，是从空中俯瞰新加坡的最佳地点。,N/A,13/08/2016
Annie,4.3,我是晚上去的，可以看到整个新加坡的夜景 很美 值得一去 平常十点关闭 周末十一点关闭,N/A,31/01/2016
惠子H,5.0,晚上八点有灯光秀，很漂亮，还有两个植物园，瀑布植物园好玩点，可以坐电梯上去,N/A,11/10/2019
我叫阿荣,5.0,买了这个票，很方便，向进口那里显示电子条码，一扫就可以进去了！然后价格比现场买便宜十块八块吧，现场买也很方便，不多人的前提下，里面有几台自助机给售票的！,N/A,23/07/2019
_WeCh****697259,5.0,总体超赞，景色不错，性价比高，,N/A,14/04/2021
渣渣Gina,0.0,超级震撼的室内花园，天空树超级美，可惜下了一天暴雨，没能看到晚上的夜景,N/A,02/02/2020
ayuko,4.0,新加坡空中花园在金沙酒店顶楼位置，可以观赏到整个新加坡的全景，特别到了晚上，那夜景真的是美不胜收，非常的漂亮，还流放着浪漫的音乐，感觉很浪漫，很喜欢。,N/A,31/01/2017
_WeCh****658477,5.0,建議約六點前往排隊上樓，欣賞傍晚夕陽落下、光影變換的美景，吹著微風休息等候，19：45超級樹炫目燈光秀和20：00制高點碼頭水舞，下樓後可再次親臨觀賞21：00碼頭水舞，享受四重感官饗宴。,N/A,17/03/2019
错了,5.0,金沙空中花园位于金沙酒店57层楼顶，就算不住金沙的也可以买一张金沙空中花园的门票，推荐傍晚去，这样可以看到傍晚的日落和夜晚的灯光秀，非常迷人的夜色。,N/A,30/06/2018
118****259,5.0,在这里可以尽情地拍照，等到天黑终于看到夜景了，太美了! 很值得一看。,N/A,26/09/2019
岑小小,0.0,感觉很不错呢，俯瞰新加坡城貌和海景，真的超美！幸好我们来的时候天气又好人又少！且工作人员非常友善又热情！下次再来的时候一定到楼顶酒吧喝上一杯！,N/A,13/02/2020
christina薇薇,5.0,新加坡金沙酒店除了无边泳池，还有这个空中花园无比赞，吸引很多不住店的人来参观，毕竟这里俯瞰整个新加坡的感觉超级赞，也是新加坡看日出最美的地方。,N/A,15/11/2019
Owen,5.0,鸟瞰新加坡景致，高处风景独好，视野开阔。,N/A,12/04/2018
爱喝柠檬茶,4.0,空中花园是一定要去的景点，自费觉得好贵啊，九点半才开放，早上去就找个地方小酌一杯，拍拍照什么的，好可惜没选在这里住，晚上风有点大，吹得有些头痛，环境还算安静，一个人独处也觉得不错。,N/A,23/01/2018
M10****675,3.0,很坑，只买金沙空中门票是过不去金沙空中泳池那边，只看到三分一的风景。而且我们是下午1-2点左右去的很晒，景色很一般观光巴士换票挺好找的，在鱼尾狮广场看完走过去金沙会经过那商场。换了票，顺便坐观光巴士过去金沙就好。金沙酒店还是很值得逛的。,N/A,22/11/2017
138****8356,5.0,天空公园视野很好，能看到滨海湾花园全景，还有摩天轮，新加坡河，但是中午上去会很晒，我们去是在周五，工作日，人不多，换票地方还算好找，总体不错,N/A,14/10/2017
justinwang1987,5.0,我不得不告诉你 真的贵 不仅仅是参观门票 连酒店的房费也真贵 好吧 好羡慕我那些有钱可以入住的朋友们 我就只好买张一百多的门票喽,N/A,18/01/2017
king宋,5.0,很不错的地方！风景好美！因为是第一站的行程，格外激动！,N/A,18/08/2018
ranerapple,5.0,很值得去，无边泳池很美，尤其海边景色。孩子们很喜欢，玩的乐不思蜀！不愧为新加坡地标！唯一缺点就是服务一般，感觉服务跟不上五星！早起还可以看海边日出，超美！,N/A,26/08/2017
DEAR张小球,5.0,金沙可以说很多人去新加坡都想入住的酒店的，当然价格是比较的贵的，不过你可以过来这里吃吃自助餐什么的也是不错的，空中花园景色确定很好。,N/A,07/06/2019
M30****2342,5.0,不住金沙的可以买一张金沙空中花园的票子，就可以到最高处去俯瞰整个坡国。票子大概100多，总比住金沙划算啦。住金沙的话就免费随便去咯。,N/A,20/02/2019
紅氿,4.0,大家不要以为金沙空中花园就是无边泳池，其实完全是两个地方。金沙有三栋不同的高楼组成所以这两个地方是从不同的口进去的。空中花园可以看到整个滨海湾花园的景色。夜里也适合看夜景。,N/A,19/03/2018
狮子鱼,5.0,壮观，惊艳，晚上夜景非常漂亮。可以看到冷加湾海景，另一边是新加坡最漂亮的滨海湾城景。建议一定不要错过无边泳池或者可以边用餐喝酒观景。,N/A,18/09/2016
爱你呀猪猪,5.0,一切尽在图片中了 宽阔平坦的视野 让所有的烦恼 暂时消去,N/A,21/02/2020
东张西望望东西,5.0,金沙不止有无边的游泳池可以玩，其空中的花园也是绝对不容易错过的，而且花园面积大，走一圈你基本上可以从不同的角度欣赏全新加坡的美景的,N/A,17/10/2019
兰夏的果实,5.0,滨海湾金沙空中花园是新加坡非常值得去的地方，楼顶有无边泳池，很多网红都会去打卡，下面还有商场，可以逛街买东西，去新加坡一定要去。,N/A,13/07/2019
悠菲,5.0,我认为还是值得去看夜景的，大白天的就不推荐了！,N/A,03/08/2019
zhuzhu79,4.0,站在金沙空中花园可以俯瞰到新加坡河、摩天轮、金融街、鱼尾狮等城市标志性景点，环顾四周，风景真的不错，在咖啡吧点上一杯咖啡，悠闲的欣赏下新加坡美景！,N/A,11/07/2017
320****987,5.0,酒店非常棒，我们预订城景房，在房间看新加坡的标志性建筑，美极啦，不住金沙，就到空中花园一游吧~居高临下，风景十分震撼~推荐。,N/A,26/05/2018
E19****95,4.3,空中俯瞰美丽的新加坡，风景确实不错。但非金沙酒店住店的旅客去不了无边泳池，有点儿遗憾。而且去的日子赶上刮风，顶楼还是很冷的。,N/A,24/01/2017
shuix****2290,5.0,人不少，手机拍出来就很美，旁边也有旅行团。,N/A,20/11/2018
yi****214,5.0,金沙天空公园，俯瞰整个新加坡的夜景，记得在楼下买票喔，没买酒吧票的话，是不能进去露天酒吧的。新加坡的夜景，真的很美。推荐。,N/A,10/10/2018
Kevin,4.0,工商银行活动送的门票，所以就去看一下，入口是在酒店的外面，有专门的入口，上去了给人感觉有点失望，很小的一个平台，也看不到花园，只是站的比较高。,N/A,24/01/2018
quinchen,5.0,【景色】新加坡的金沙造了两座穹顶花园，一座里面是各种花，四季不同一直会换，很漂亮。另一座是云雾缭绕的感觉。 走在空中走廊sky bridge上俯瞰新加坡 感觉很妙啊！,N/A,01/08/2020
louisrik,4.0,金沙酒店顶层花园，从56层高的楼顶瞭望一周新加坡这个花园式城市的现代化美景，已经值回登顶的票价。 全日最精彩一站～星耀樟宜。在投资17亿坡纸的全新商场内，50米高的室内瀑布足够震撼，每小时一次的幻彩灯光秀非常梦幻且内容绝不重复，在这里呆坐一两个小时都不会觉得闷。,N/A,11/09/2019
大海老牛,5.0,夜幕下的新加坡真的很美，傍晚登金沙，感受这座大都市的迷人灯光渐渐亮起。。。。。。,N/A,11/03/2019
欢乐随喜,4.3,在滨海湾金沙全景环绕中小酌，欣赏世界一流的都市风光、滨海湾花园中充满科幻气息的美丽超级树（Supertree Grove）以及五彩斑斓、生机勃勃的滨海湾花园胜景。举目远眺，从滨海南码头沿路至新加坡海峡，一条条船运航线熙熙攘攘，铸就了新加坡丰富多彩的多文化历史。在静谧夜空下捕捉恢宏壮观 Spectra 水幕灯光秀的盛景，高空观景台都是提升您摄影技术的最佳景点。,N/A,19/02/2019
m10****748,4.0,从金沙tower 3一层最北边的门出去，左手下去看到售票处，在携程上买票比现场买便宜。到入口时要出示邮件，与其它景点不一样。称为空中观景台更恰当。安排在行程最后一天更好些，从空中看到自己游览过的各个景点，感觉亲切兴奋，对滨海湾周边及花园也有了个整体的认识。向各个方向观望一下，用不了多少时间。,N/A,11/02/2019
135****4902,5.0,非常推荐！看到别人换票后才能进入，以为自己也要换票，确定后才知道，通过携程发的条码扫码直接进入，还好携程提示要提前保存条码，我在门口出示条码后，直接开闸进入，快捷方便，价格合理。本来以为这个景点不好找，结果一点没费事，我走过双螺旋桥后，进入金沙购物商城，一路跟着指示SkyPark走就对了，很快就找到。有点坑爹的是空中花园门口有帮你拍照的，价格60新币，真心觉得好贵！,N/A,31/10/2018
M22****7244,4.0,金沙空中花园很小一块地方供买票的游客观赏，楼顶无边泳池的影儿都看不到。进刷票口之前有个简易拍照区，工作人员让进去的游客都在此处合影，然后再扫码进去，电梯直接到楼顶。卖照片的让你选照片，$80新一张加一个亚克力纪念卡，一个小卡。单照片$45新。非常不划算，相片背景是P的新加坡背景……【大家不要去买照片】空中花园观景如图,N/A,19/08/2018
小虫寵,0.0,金沙空中花园就在著名的金沙酒店的顶层，这里可以说是欣赏新加坡著名的金融区的好地方之一，在鱼尾狮公园那里就可以抬头看到空中花园，夜晚的灯光秀就是从花园底部射出的。,N/A,01/08/2018
环球小女子,0.0,其实这里就是著名的金沙大酒店了，可以从上往下看，整个城市面貌尽收眼底。特别推荐的是它的无边游泳池，入住就可以免费使用了。,N/A,25/07/2017
sabrina,3.7,空中花园在金莎酒店的顶楼，可是入口在金莎酒店外。在这里俯瞰可以俯瞰整个新加坡。由于不是完整的环形，所以有一边看不到。可以看到滨海湾花园，鱼尾狮及周边，远处在海上停泊的轮船等等。在这里看新加坡艺术科学博物馆真的很像“一把香蕉”呢。,N/A,14/12/2016
zeniahx,5.0,逼格相当高的一个地方呀！豪华型酒店的上面，在酒店的顶部有个空中花园，里面还有个很大的无边际的泳池！经济允许一定要去看看！,N/A,21/12/2015
laolizi66,5.0,金沙空中花园一共有57层楼那么高，这里是，看新加坡美景的最佳地点，而且价格是观景台当中比较便宜的，只要二十多块钱。晚上整个新加坡，尽收眼底，灯光点点特别好看。,N/A,07/11/2016
神仙囉,5.0,很好的体验啊。携程买票也方便。值得推荐的项目啊！可以看另一边无边泳池超多人。,N/A,14/09/2018
M23****797,5.0,景色优美，仿佛到了三亚红树林度假村。,N/A,27/05/2016
_WeCh****357320,5.0,【景色】很漂亮哦！航拍照片特别美！,N/A,19/02/2020
喜乐宝贝儿,5.0,这里是鲜花的世界，特别喜欢这种感觉,N/A,05/02/2019
navy****1998,5.0,空中花园在金沙酒店的顶层，酒店住客可以免费游览，其他游客购票观光，在这里能够360度的拳脚俯瞰新加坡的繁华之美。,N/A,16/08/2019
连引,5.0,夜景不错，坐上面吹风，感觉很惬意,N/A,15/10/2018
扶余查尔斯,5.0,风景如画，能看到新加坡的全景。,N/A,10/07/2018
138****6557,5.0,值得一去，但上去的路线要找对！,N/A,03/06/2018
_CFT01****6410220,5.0,大概中午2点去的，感觉挺不值的，不是金沙住客的话，只能在平台转，进不了花园的。不如去旁边的滨海湾花园，冷气也足,N/A,08/06/2017
灰姑娘的南瓜车,4.7,亚洲最大的空中花园，更是新加坡最引人入胜的视野观景台，一面悠游还能将新加坡璀灿炫烂的美景尽收眼底。在空中花园观景台享受美食与美酒，美丽的夜景与你为伴。,N/A,31/12/2015
D14****23,5.0,不能去游泳池，有些遗憾，建议选择金沙酒店住较好。风景好，交通也便利。就是价格小贵啊。新加坡地方不大，很精致。,N/A,07/10/2019
M28****01,5.0,一栋大楼的植物，美轮美奂，一步一景，水雾缭绕，真的好美啊，人工景观能做到这样真的还是很佩服新加坡人的智慧。,N/A,18/09/2017
whatever,5.0,新加坡的金沙空中花园真的是美轮美奂，非常壮观，是新加坡的地标建筑之一，尤其是到了晚上，当所有灯亮起的时候，配着夜景更加美丽。,N/A,01/07/2017
白马游子,0.0,新加坡湾美景尽收眼底。,N/A,02/04/2020
Wendy  Zheng,4.7,空中花园设有可同时容纳几百人的公共观景台，宾客们在此能一览南中国海、滨海湾、以及新加坡城市的美景。最让人称奇的是位于空中花园的无边游泳池，全长150米，距离地面200多米高，是全球最大的空中室外无边际游泳池。游泳池的边缘看似无任何遮挡，就像瀑布的边际一样，与远处高楼大厦的景致相得益彰。看似危险，却显浪漫。,N/A,27/01/2018
M15****026,5.0,在金沙酒店观景台俯瞰新加坡非常震撼，没有时间限制，我们六点上去，一直待到黑天看到夜晚霓虹灯，美极了！,N/A,14/08/2017
girl__521,5.0,其实我觉得在上面喝点酒感觉更好。风景那么好，要慢慢享受。,N/A,09/05/2018
cheng66,5.0,这个花园还是挺不错的，在整个新加坡来说都有一定的地位，作为一个景点，他也是一个必游之地，而且挺漂亮的，感觉新加坡的人创意比较好，特别好。,N/A,26/12/2016
Princesstt,4.0,很后悔我们不是晚上过来的，后面才听说其实过来看夜景会更漂亮。不过这个空中花园也确实很有创意，也是充分利用了空间把。上面看看也是心情愉悦,N/A,17/03/2019
D40****045,4.0,虽然不能去到无边泳池，但俯瞰整个新加坡的感觉还是很不错的平台上的餐饮也不贵,N/A,26/08/2017
320****987,5.0,买票来到著名的酒店空中花园。在这里俯瞰新加坡，确实很壮观，能看到摩天轮和滨海湾花园以及无敌海景。另一端的无边泳池，只对酒店的住客开放。,N/A,22/12/2016
星海湾北,5.0,金沙空中花园位于新加坡网红酒店滨海湾金沙酒店的楼顶，是鸟瞰狮城的好地点。花园旁边还有一些有特色的餐厅和酒吧，晚上去用餐和观景很棒！,N/A,13/02/2020
gre****ner,0.0,金沙顶 一出门，太震撼了，新加坡bay太漂亮了。只有登上这个屋顶，才能领略新加坡的美丽全貌。,N/A,13/01/2016
m35****7524,5.0,夜景太美了，人们都或坐或站的看着下面美丽的灯光，吹着夜风、海风，晚上的新加坡还是非常舒适的。两个贝壳状的是滨海湾花园的两个场馆。,N/A,31/12/2020
taxuewuheng,5.0,金沙空中花园确实是挺漂亮的，而且植物也是成千种。如果可以的话，你可以住在旁边的金沙酒店，可以看到这里简直是一览无余。挺推荐的。,N/A,04/01/2017
林子,4.7,喜欢她的无边泳池，喜欢她的大牌云集，喜欢她集吃喝玩乐于一体，不喜欢的是永远的排队登记入住和派对，退房，还有大厅永远是那么多人！,N/A,06/07/2016
320****235,4.0,不太推荐，不能去无边游泳池的，不如去座摩天轮，新加坡就这点地方从高看下去就一样了。金沙酒值得一去，要么住一晚 ，就能去游泳池,N/A,16/07/2019
_WeCh****90003,5.0,非常有意思的空中花园，视野很好，俯瞰新加坡,N/A,31/07/2017
__赛__,5.0,空中公园在金沙酒店的顶层，住在酒店的话免费进入，在这可以饱览新加坡滨海湾的美景，摩天轮，高楼大厦都能尽收眼底，推荐上去看看,N/A,25/01/2017
M23****2947,5.0,新加坡的标志性景点，怎能不去？买票排队真心累呀，幸好有携程，买票方便快速，免预约，不用换票，直接刷码就可以啦，真的不错！,N/A,21/08/2019
M25****4707,5.0,新加坡空中花园如同一个巨型的冲浪板横跨在三座酒店的顶部。这座耗资1亿多美元建造的空中花园，占地1.24万平方米，距离地面200多米高，种植了250多棵树木和650多株植物，可同时容纳3900人参观游览。,N/A,09/05/2019
_m13****6354,4.0,可逛的地方其实不大，但在上面俯视滨海湾的感觉还携程买的票比现场买便宜大概20来块，而且电子票发货很快，很方便。非金沙住户只能去到56层，可逛的区域不大，但从这边俯视整个滨海湾的感觉是很不错的，如果是晚上上来可以看到滨海湾花园的夜景应该更漂亮一些吧。总体感觉值得一看，但票价略贵吧,N/A,23/02/2019
20****023,5.0,***,N/A,14/02/2019
Tony淇,5.0,可以不住金沙酒店，可以不去无边泳池，但是一定要去天空花园。对于工薪族的我来说金沙一晚上的住宿费相当于在那住普通酒店四天了，为了节省开支当然就不住金沙啦～，不过天空花园是一定要去的，花个一百多人民币，在上面待个4、5个小时，基本可以把所有的日景和夜景以及两个灯光秀都看全了。上面的商店点杯鸡尾酒，找个地方坐下休息，一边品尝美酒一边吹着微风一边看着美景一天下来的疲劳都飞走了，而且那种微醉的感觉还是非常惬意的。（行程不是很赶的都可以在上面多待会，真的很舒服。8点左右下去正好看灯光秀的第二场）,N/A,03/02/2018
小白_1912,4.0,金沙空中花园，其实倒也不是刻意过来的，只是正好要去海滨湾花园，拐弯看看。 上来可以俯瞰新加坡市景，尽量晚上过来，灯红酒绿、车水马龙，这才是现代都市的代名词吧。 白日里，大家都在各自忙碌，只有到了夜晚，才是各种回归。,N/A,22/12/2016
黄太Joan,0.0,为了看日落我们在金沙空中花园从六点呆到七点半，找了个视角好的座位盘腿而坐。从白昼到日落到黑夜降临，整个过程虽然漫长但是也很是有趣。华灯初上，对面的林立的高楼开始亮灯，各个繁华城市总是有着很亮眼的灯景，诸如上海外滩、又如香港中环，这些灯光映射出这个城市的生机和那些浮华。,N/A,16/02/2016
天使在游荡,5.0,位于金沙娱乐城的新加坡空中花园，占地1.24万平方米，斥资1亿多美元建造的花园种植了250多棵树木和650多株植物，可以同时容纳3900人参观，另外空中花园还设有可同时容纳几百人的公共观景平台，宾客可以在此浏览到美丽的景色。,N/A,01/02/2016
SnowScorpio,4.0,看夜景很不错，风很大很舒服。从金沙酒店大堂到Tower3外面的自动扶梯到B1就是入口。提前携程订票可以直接刷条码进去。,N/A,30/09/2018
M17****984,4.3,是个标志性建筑，在下仰望建筑顶端仿佛像个大型的冲浪板，门票价格不好，顶上是个美丽的大型花园，如果不恐高，也可以俯瞰海景,N/A,01/11/2015
小圈子丶66,5.0,晚上登上金沙顶上期待灯光秀，超级棒！,N/A,19/12/2018
三升换五斗,5.0,晒死人了，没有什么意思……人很多……,N/A,21/06/2016
热爱生活0618,4.0,可以以360 度全角俯瞰新加坡。这片1.2 公顷的热带绿洲比横躺下的埃菲尔铁塔还要长，而且尺度宽阔，足以停放4 架半A380 大型喷气式客机。,N/A,05/02/2019
M15****574,5.0,很漂亮，能看到整个新加坡的景象，就是一个很高的楼层，和上海东方明珠差不多,N/A,16/08/2018
M62****213,5.0,建议来新加坡一定要傍晚的时候来空中花园，看夕阳西下，新加坡美景尽收眼底。,N/A,07/06/2018
Miss Junny,4.0,视野真的太棒了，黄下午5-6点时上去不仅看黄昏也能看夜景，一望无际所有新加坡的知名地标几乎都能看到，从高处(很高)往下看，跟一般在平地看的感觉差距大，很值得到访，让自己对新加坡有另一种体验。,N/A,04/06/2020
照亮天空,5.0,金沙就是金沙，夜景非常美丽。。,N/A,21/11/2019
_M18****0049,4.0,感觉性价比一般，只能上到56层平台去看一圈，白天太晒了，没有遮阴的和休息座椅，建议晚上上去看夜景，可能凉快些。,N/A,30/06/2019
298****645,4.3,可以俯瞰新加坡全景，值得一去。,N/A,13/11/2017
