username,rating,content,time,image,UserURL,Attraction,is_english
_TI***0u,5.0,It was really very amazing experience,27/07/23,0,https://sg.trip.com/review/singapore-botanic-gardens-76133-177764708?locale=en-SG,Botanic Garden,True
Daf15h,5.0,stunning and amazing. a great day out.,25/07/23,0,https://sg.trip.com/review/singapore-botanic-gardens-76133-177747765?locale=en-SG,Botanic Garden,True
9319,5.0,nice scenery and recommebd to visit.,18/10/23,0,https://sg.trip.com/review/singapore-botanic-gardens-76133-179435891?locale=en-SG,Botanic Garden,True
E38***70,5.0,The best garden you can ever imagine!,28/09/23,0,https://sg.trip.com/review/singapore-botanic-gardens-76133-179147983?locale=en-SG,Botanic Garden,True
shawnda porter,5.0,wonderful experience I loved it....,09/08/23,0,https://sg.trip.com/review/singapore-botanic-gardens-76133-178219334?locale=en-SG,Botanic Garden,True
_TX***ic,5.0,isa nice place to visit and shooting,25/08/23,0,https://sg.trip.com/review/singapore-botanic-gardens-76133-178586334?locale=en-SG,Botanic Garden,True
traveltolalaland,5.0,"UNESCO World Heritage Site - A garden for everyone and every age. Stroll there, picnic there, exercise there - just have a great day at this humongous garden. It is amazing for educational, recreational, and entertainment purposes. Its our all time favourite place in Singapore.IG Handle: traveltolalaland",17/07/23,9,https://sg.trip.com/review/singapore-botanic-gardens-76133-177626369?locale=en-SG,Botanic Garden,True
_TI***ib,5.0,Nice place to visit if u like nature,13/10/23,0,https://sg.trip.com/review/singapore-botanic-gardens-76133-179366936?locale=en-SG,Botanic Garden,True
KarloSvonja,5.0,peaceful garden to clear your mind,26/09/23,0,https://sg.trip.com/review/singapore-botanic-gardens-76133-179137273?locale=en-SG,Botanic Garden,True
_TI***b1,4.0,the views were amazing! It is definitely a must visit spot when you are there,14/09/23,0,https://sg.trip.com/review/singapore-botanic-gardens-76133-178980456?locale=en-SG,Botanic Garden,True
Pmtm Family,5.0,Excellent Place for relax,17/10/23,0,https://sg.trip.com/review/singapore-botanic-gardens-76133-179433825?locale=en-SG,Botanic Garden,True
Wiser1979,5.0,nice and beautiful garden,17/10/23,0,https://sg.trip.com/review/singapore-botanic-gardens-76133-179429615?locale=en-SG,Botanic Garden,True
Ebing,5.0,Very beautiful and clean.,15/10/23,0,https://sg.trip.com/review/singapore-botanic-gardens-76133-179416960?locale=en-SG,Botanic Garden,True
muhammad yasin farid,5.0,if you love tree visit here,22/08/23,0,https://sg.trip.com/review/singapore-botanic-gardens-76133-178540131?locale=en-SG,Botanic Garden,True
Verchacha,5.0,Unbelievably Beautiful!,22/07/23,0,https://sg.trip.com/review/singapore-botanic-gardens-76133-177702610?locale=en-SG,Botanic Garden,True
_TS***lq,5.0,beautiful garden not to be missed. Orchid garden has many types of orchids,12/05/23,3,https://sg.trip.com/review/singapore-botanic-gardens-76133-175816715?locale=en-SG,Botanic Garden,True
D33***22,5.0,Beautiful place to relax,01/09/23,0,https://sg.trip.com/review/singapore-botanic-gardens-76133-178752540?locale=en-SG,Botanic Garden,True
ikhan,5.0,it was nice place to visit,20/08/23,0,https://sg.trip.com/review/singapore-botanic-gardens-76133-178516937?locale=en-SG,Botanic Garden,True
Marjun123,5.0,"Singapore&rsquo;s one of the scenic view including airports, marina bay sands and botanical gardens,",28/01/23,2,https://sg.trip.com/review/singapore-botanic-gardens-76133-174739001?locale=en-SG,Botanic Garden,True
_TS***br,5.0,mind blowing place to be,17/08/23,0,https://sg.trip.com/review/singapore-botanic-gardens-76133-178349452?locale=en-SG,Botanic Garden,True
_TX***pn,3.0,"it&rsquo;s a nice place but nothing really special. I recommend going only if you are going to spend a long time in Singapore, like two weeks or more.",01/08/23,0,https://sg.trip.com/review/singapore-botanic-gardens-76133-178008417?locale=en-SG,Botanic Garden,True
DChong,5.0,Beautiful all natural World Heritage Site.  The only World Heritage Site Singapore has to offer.  The gardens are free to visit but you must pay $15 Singaporean dollars for national orchard garden.,19/07/23,5,https://sg.trip.com/review/singapore-botanic-gardens-76133-177656209?locale=en-SG,Botanic Garden,True
KHANHCDLA,5.0,"The Singapore Botanic Gardens is a well-defined cultural landscape which includes a rich variety of historic landscape features, plantings and buildings that ...",17/07/23,6,https://sg.trip.com/review/singapore-botanic-gardens-76133-177635332?locale=en-SG,Botanic Garden,True
Shuger,5.0,Nice big garden with many sections to explore and stroll on the weekends. Good for family picnics. My favourite are the orchids,17/07/23,5,https://sg.trip.com/review/singapore-botanic-gardens-76133-177625463?locale=en-SG,Botanic Garden,True
Seforah,5.0,The botanical gardens is the perfect place to escape the busy city and take a nice walk. it&rsquo;s very pretty and the orchid garden is a must visit.,14/07/23,5,https://sg.trip.com/review/singapore-botanic-gardens-76133-177588815?locale=en-SG,Botanic Garden,True
_TS***nl,5.0,One of the best place to visit is Singapore. If you want to get e green escape best place to go there.There is a orchid garden as well. having separate ticket. they are giving special discount tor senior citizens.A go to place for locals for daily jogging.,09/07/23,9,https://sg.trip.com/review/singapore-botanic-gardens-76133-177531753?locale=en-SG,Botanic Garden,True
Adam Akira,5.0,"Singapore Botanic Gardens is a truly magnificent and captivating destination for nature lovers and enthusiasts of all ages. This iconic botanical garden offers an awe-inspiring experience with its stunning landscape, diverse plant life, and serene ambiance.One of the highlights of the Singapore Botanic Gardens is its vast collection of plants and flowers. From the breathtaking Orchid Garden, which showcases an incredible variety of orchid species, to the lush and vibrant National Orchid Garden, visitors are treated to a kaleidoscope of colors and fragrances that are simply enchanting. The garden&#39;s meticulous organization and maintenance ensure that every corner is a visual delight.The Botanic Gardens is not only a feast for the eyes but also a place of tranquility. Whether you&#39;re taking a leisurely stroll along the meandering pathways, having a picnic on the well-manicured lawns, or simply finding a quiet spot to relax, the garden offers a peaceful respite from the bustling city outside. It&#39;s a haven where one can escape the urban chaos and connect with nature.Another notable feature of the Singapore Botanic Gardens is its commitment to education and conservation. The garden houses a research center and provides educational programs and workshops to promote awareness and understanding of plant life. The dedication to preserving and studying the botanical world is evident throughout the gardens, making it an educational and enlightening experience for visitors.Moreover, the amenities and facilities at the Singapore Botanic Gardens are top-notch. There are well-maintained restrooms, convenient seating areas, and a variety of food and beverage options. The garden&#39;s accessibility is also commendable, with wheelchair-friendly paths and ramps, ensuring that everyone can enjoy its beauty.One minor drawback is that the garden can get crowded, especially during weekends and public holidays.",09/07/23,9,https://sg.trip.com/review/singapore-botanic-gardens-76133-177530561?locale=en-SG,Botanic Garden,True
Elainne Pauline Solidum,5.0,"One of the coolest and peaceful places in Singapore. If you&rsquo;re on to Fiona and Faura, Botanic Garden is the place to be. Bring your friends and family, 100% must see in your SG trip.",07/07/23,9,https://sg.trip.com/review/singapore-botanic-gardens-76133-177498319?locale=en-SG,Botanic Garden,True
Koem Rathbormey,5.0,"It&#39;s easy to get to. It&#39;s free to enter. It&#39;s open from 5 am till midnight, and you can sit on the immaculate grass. This garden is probably my favorite place in Singapore 🌱",06/07/23,9,https://sg.trip.com/review/singapore-botanic-gardens-76133-177494354?locale=en-SG,Botanic Garden,True
E57***74,5.0,"Singapore Botanic Gardens is a must-visit destination for a family trip. The garden offers a delightful experience with its beautiful orchid garden, featuring a cool room filled with numerous stunning and vibrant orchids. It&#39;s a treat for the eyes! The spacious and well-maintained garden provides a pleasant environment for families to explore, relax, and enjoy nature. With its variety of flora and fauna, the Botanic Gardens offers an educational and immersive experience for children and adults alike. Don&#39;t miss out on this serene oasis in the heart of Singapore, where you can admire breathtaking orchids in a refreshing setting",03/07/23,5,https://sg.trip.com/review/singapore-botanic-gardens-76133-177443187?locale=en-SG,Botanic Garden,True
_TS***gp,5.0,A very special place. Despite being in the middle of the Garden City of Singapore it is possible to escape into the damp dark tropical rain forest. Well laid out and sign posted the information on the tree and plant collections is superb. We attended one of the weekend outdoor concerts in the gardens which despite the rain (which added to the atmosphere) was a lot of fun.,30/06/23,5,https://sg.trip.com/review/singapore-botanic-gardens-76133-177304174?locale=en-SG,Botanic Garden,True
Bebe Story,5.0,"The Gardens&rsquo; have continued to evolve, with some of the latest attractions including the Seedbank and Tropical Montane Orchidetum. The Gallop Extension is the most recent addition and features&nbsp;two conserved buildings that have been revamped from a former colonial bungalow. It&rsquo;s accessible via a 200m bridge from the Learning Forest.&nbsp;&nbsp;Explore these new additions, along with some of our other long-time favourites in this guide to the Botanic Gardens.&nbsp;",13/06/23,5,https://sg.trip.com/review/singapore-botanic-gardens-76133-176234488?locale=en-SG,Botanic Garden,True
shylah08,5.0,Singapore Botanic Gardens you will be amaze at their different kinds of plants they are using it for decoration and medicines,07/06/23,7,https://sg.trip.com/review/singapore-botanic-gardens-76133-176079730?locale=en-SG,Botanic Garden,True
Daniel Dinesh,5.0,A wonderfull experience to get away from busy cities. mind relaxing and calm. a really good time to spend with friends and family. so good!,06/06/23,1,https://sg.trip.com/review/singapore-botanic-gardens-76133-176062058?locale=en-SG,Botanic Garden,True
_TI***ye,5.0,"Amazing views, so pretty! Not a bad hike, we did it after the beach and just threw some sneakers on. I got a nice tan on the way up as well",06/06/23,1,https://sg.trip.com/review/singapore-botanic-gardens-76133-176062017?locale=en-SG,Botanic Garden,True
Jyz2,5.0,super nice garden to hang out. it even has a healing garden with many many types of plants that represent different systems in the human body.,03/06/23,1,https://sg.trip.com/review/singapore-botanic-gardens-76133-176032621?locale=en-SG,Botanic Garden,True
_TI***gg,5.0,I love this place! super quiet and chilled out even on a weekend! lots of bird and wildlife too which is lovely in the city.,01/06/23,1,https://sg.trip.com/review/singapore-botanic-gardens-76133-176013704?locale=en-SG,Botanic Garden,True
Hyhyht,5.0,"Singapore Botanic Gardens is a true horticultural masterpiece. Its stunning landscapes, diverse plant species, and commitment to conservation make it a must-visit destination for locals and tourists alike. Whether you&#39;re a nature lover, a photography enthusiast, or simply in search of a tranquil retreat, this botanical paradise will leave you with lasting memories and a deep appreciation for the natural world.",31/05/23,1,https://sg.trip.com/review/singapore-botanic-gardens-76133-176005268?locale=en-SG,Botanic Garden,True
miss mum,5.0,The Gardens has been inscribed as a UNESCO World Heritage Site in 2015. The Gardens is the first and only tropical botanic garden on the UNESCO&rsquo;s World Heritage List.,29/05/23,1,https://sg.trip.com/review/singapore-botanic-gardens-76133-175985992?locale=en-SG,Botanic Garden,True
Japonamama,5.0,"I recently had the pleasure of visiting the Singapore Botanic Gardens, and I must say it was a truly enchanting experience. From the moment I entered the gates, I was greeted by a serene and captivating atmosphere that instantly made me forget I was in the bustling city.",28/05/23,1,https://sg.trip.com/review/singapore-botanic-gardens-76133-175968708?locale=en-SG,Botanic Garden,True
tang0912,5.0,"The Singapore Botanic Gardens is a beautiful and tranquil oasis located in the heart of Singapore. The gardens are a popular destination for both locals and tourists, offering a wide range of flora and fauna to admire, as well as a host of outdoor activities to enjoy.The gardens are well-maintained and feature a variety of walking paths and trails that wind through lush greenery and vibrant flower beds. Visitors can also explore the many themed gardens, including the National Orchid Garden, which houses a stunning collection of orchids, and the Healing Garden, which features medicinal plants and herbs.In addition to the gardens themselves, the Singapore Botanic Gardens also hosts a variety of events and concerts throughout the year, making it a popular spot for cultural and social gatherings. The gardens also offer several dining options, including a popular cafe that overlooks the gardens.Overall, the Singapore Botanic Gardens is a must-visit destination for anyone traveling to Singapore. Its beautiful landscapes, rich biodiversity, and peaceful atmosphere make it a welcome escape from the hustle and bustle of city life.",27/05/23,1,https://sg.trip.com/review/singapore-botanic-gardens-76133-175959306?locale=en-SG,Botanic Garden,True
Ottokebaby,5.0,"wonderful and magical placee!!! the best garden i ever visited, the air there is so refreshing and comforting!! will visit again for sure 👌🏼",26/05/23,1,https://sg.trip.com/review/singapore-botanic-gardens-76133-175953723?locale=en-SG,Botanic Garden,True
cindy0604,5.0,"🌺🌿 The Singapore Botanic Gardens is a breathtaking oasis in the heart of the city! With over 150 years of history, it&#39;s one of the oldest and most beautiful gardens in the world. Explore the lush greenery, marvel at the stunning orchids, and enjoy the tranquil atmosphere. A must-visit for anyone seeking a peaceful escape from the city! 🌳👀",25/05/23,1,https://sg.trip.com/review/singapore-botanic-gardens-76133-175941793?locale=en-SG,Botanic Garden,True
Timsina,5.0,"Singapore Botanic Gardens is a serene oasis in the bustling city-state of Singapore. With its lush greenery, vibrant flowers, and tranquil ponds, I find that it&rsquo;s the perfect place to escape the city and reconnect with nature.",14/05/23,1,https://sg.trip.com/review/singapore-botanic-gardens-76133-175832923?locale=en-SG,Botanic Garden,True
Ployssi,5.0,"A testament to Singapore&#39;s reputation as a City in Gardens, the Botanical Garden is the country&#39;s first UNESCO Heritage Site, rivaling famous sites like Cambodia&#39;s Angkor Wat and the Great Wall of China.Established in 1859 by the Agro-Garden Association, 60 acres of fallow farmland was converted into a popular garden for the recreational needs you see today.",13/05/23,1,https://sg.trip.com/review/singapore-botanic-gardens-76133-175821555?locale=en-SG,Botanic Garden,True
Agata W,5.0,A great place to visit at any time but especially early morning. I had a stroll and was able to see lots of interesting plants. A good place for family activities and spending time together.,12/05/23,1,https://sg.trip.com/review/singapore-botanic-gardens-76133-175818693?locale=en-SG,Botanic Garden,True
andrew13,5.0,"The Singapore Botanic Gardens is free to explore, except for the National Orchid Garden. It&#39;s a wonderful place to visit if you&#39;re looking for an opportunity to spend some time outdoors and appreciate the Gardens",12/05/23,1,https://sg.trip.com/review/singapore-botanic-gardens-76133-175812536?locale=en-SG,Botanic Garden,True
Pooh Lim,5.0,The Gardens is the first UNESCO Heritage Site in Singapore. Great place to be in nature with fresh air and to relax your day. There are many interesting plants and trees to learn and see. Highly recommended!,28/04/23,1,https://sg.trip.com/review/singapore-botanic-gardens-76133-175648739?locale=en-SG,Botanic Garden,True
Genevie Graham,5.0,"It&rsquo;s always a refreshing walk at Singapore&rsquo;s Botanic Gardens. You&rsquo;ll be greeted by lush greens, colorful flowers, and the calming sound of the water. It is such a wonderful way to connect with nature. It&rsquo;s truly a wonderful place for everyone to visit.",22/04/23,1,https://sg.trip.com/review/singapore-botanic-gardens-76133-175583041?locale=en-SG,Botanic Garden,True
Heavenly Vista,5.0,"The Botanic Gardens is a popular destination for outdoor recreational activities such as jogging, picnicking, and yoga. It also has several restaurants and cafes where visitors can relax and enjoy the beautiful surroundings.",16/04/23,1,https://sg.trip.com/review/singapore-botanic-gardens-76133-175526103?locale=en-SG,Botanic Garden,True
OSAMA ALMEKHLAFI,5.0,"itis well worth the cost. We probably took a hundred photos of the orchids with their stunning colors and forms. Wear comfy shoes and a sun hat, and stay hydrated.",15/04/23,1,https://sg.trip.com/review/singapore-botanic-gardens-76133-175521517?locale=en-SG,Botanic Garden,True
Pi Bongs,5.0,"I so love this place it gives you so much peace and serenity. Do you know that this Botanic Gardens have existed for almost two centuries? Yes, that&#39;s right and it is well kept and maintained! I have always been in love with plants and so I love this place a lot!",08/04/23,1,https://sg.trip.com/review/singapore-botanic-gardens-76133-175446487?locale=en-SG,Botanic Garden,True
Chelsea Mae Artiaga,4.0,perfect for nature walks and runs. saw some animals that popped up out of nowhere like the monitor lizard and squirrels.,30/03/23,3,https://sg.trip.com/review/singapore-botanic-gardens-76133-175348231?locale=en-SG,Botanic Garden,True
Dex888,5.0,"national flower . vanda miss Joaquim. On 15 April 1981, Vanda Miss Joaquim (Papilionanthe Miss Joaquim) was selected as Singapore&#39;s National Flower. It was selected from among 40 flowers, out of which 30 were orchids.",18/03/23,1,https://sg.trip.com/review/singapore-botanic-gardens-76133-175216637?locale=en-SG,Botanic Garden,True
King korsah kofi II,5.0,"The Singapore Botanic Gardens is a well-defined cultural landscape which includes a rich variety of historic landscape features, plantings and buildings that clearly demonstrate the evolution of the Botanic Gardens since its establishment in 1859. Through its well-preserved landscapes. if you are person of nature , peace and love you can definitely visit here .",14/03/23,1,https://sg.trip.com/review/singapore-botanic-gardens-76133-175184470?locale=en-SG,Botanic Garden,True
Khoirun Annisah,5.0,Singapore Botanic Gardens showcases the best and most spectacular of tropical flora set in stunning verdant landscape.,07/03/23,1,https://sg.trip.com/review/singapore-botanic-gardens-76133-175110839?locale=en-SG,Botanic Garden,True
Lordy,5.0,"when i first visited here at singapore botanic garden, i feel like I&#39;m at the garden of Eden.. A very very amazing place to visit.",31/01/23,1,https://sg.trip.com/review/singapore-botanic-gardens-76133-174774505?locale=en-SG,Botanic Garden,True
WUNZHENG,5.0,"This picturesque garden features a meandering stream that flows into a pond lined with wetland plants and offers many shady spots to sit and take in the view. It is also a working landscape that captures excess rainwater to reduce urban flooding.Look forRiparian plants like summer-blooming hibiscus, rushes and sedges, and umbrella plant. These are plants that have adapted to living near the water&#39;s edge, and some also help clean and filter the water.The rock weir, which helps regulate the depth of the pond. When heavy rains are approaching, the pond can drop to accommodate excess stormwater and reduce runoff.Water fowl and other wildlife. Ducks, herons, frogs, and dragonflies are all drawn to the pond and stream.",14/06/22,4,https://sg.trip.com/review/singapore-botanic-gardens-76133-171072194?locale=en-SG,Botanic Garden,True
MD NAIMUL ISLAM,5.0,wow so beautiful place,30/08/23,0,https://sg.trip.com/review/singapore-botanic-gardens-76133-178727941?locale=en-SG,Botanic Garden,True
Morokod Seng,5.0,very good atmosphere!,19/08/23,0,https://sg.trip.com/review/singapore-botanic-gardens-76133-178485547?locale=en-SG,Botanic Garden,True
Robert17,5.0,A glorious Botanic Garden! Our favourite being the rain forest that once covered Singapore.&nbsp;,26/05/23,2,https://sg.trip.com/review/singapore-botanic-gardens-76133-175955779?locale=en-SG,Botanic Garden,True
Chelsea Mae Artiaga,4.0,perfect for nature walks and runs. saw some animals that popped up out of nowhere like the mo itor lizerd and squirrels.,30/03/23,3,https://sg.trip.com/review/singapore-botanic-gardens-76133-175348199?locale=en-SG,Botanic Garden,True
Syahir Bin Shawall,5.0,"A great place to have a picnic with your partner. And when it&rsquo;s late, it gets even more romantic.",25/01/23,2,https://sg.trip.com/review/singapore-botanic-gardens-76133-174699692?locale=en-SG,Botanic Garden,True
_TX***dk,5.0,good for morning walk,19/10/23,0,https://sg.trip.com/review/singapore-botanic-gardens-76133-179445138?locale=en-SG,Botanic Garden,True
Anonymous User,5.0,Took the chance and visit flower dome during Chinese New year for its themed floral display -Dahlia Dreams. No regrets as the decorations were really pretty especially the huge dragon centerpiece! Great place to spend time with family !,16/02/24,4,https://sg.trip.com/review/gardens-by-the-bay-94795-180753475?locale=en-SG,Garden by the bay,True
Anonymous User,5.0,Absolutely love it! Especially the CNY floral display in flower dome is so so impressive! We spent about an hour there to look through the floral exhibit.,14/02/24,3,https://sg.trip.com/review/gardens-by-the-bay-94795-180729099?locale=en-SG,Garden by the bay,True
Anonymous User,5.0,it is a extremely huge garden and it&rsquo;s impossible to finish visiting in a day! There are many activities and other themed gardens that are worth visiting!,02/01/24,6,https://sg.trip.com/review/gardens-by-the-bay-94795-180281234?locale=en-SG,Garden by the bay,True
3MSGPFamily,5.0,visited cloud forest featuring avatar adventures and the flower dome. what an amazing experience. buy ticket online as the on site ticketing is always long queue.,01/01/24,5,https://sg.trip.com/review/gardens-by-the-bay-94795-180273252?locale=en-SG,Garden by the bay,True
Mung Pi,5.0,"Gardens by the Bay in Singapore is a horticultural masterpiece that captivates with its stunning blend of nature and technology. The iconic Supertree Grove, with its vertical gardens and nightly light show, is a visual feast. The Cloud Forest&#39;s misty ambiance and unique plant collection create an immersive experience, while the Flower Dome showcases diverse flora in a controlled climate. The attention to detail in design and sustainability initiatives is commendable. Although it can get crowded, especially during peak times, the overall enchanting atmosphere and innovative landscapes make Gardens by the Bay a must-visit, leaving visitors in awe of its beauty and ingenuity.The transportation is also very convenient. You can take blue and yellow MRT to get there.",23/12/23,5,https://sg.trip.com/review/gardens-by-the-bay-94795-180151054?locale=en-SG,Garden by the bay,True
JunenoTrip,5.0,it&#39;s definitely a must see in Singapore. very well maintained huge flora and nature area. great view of the MbS,07/01/24,4,https://sg.trip.com/review/gardens-by-the-bay-94795-180304575?locale=en-SG,Garden by the bay,True
LipingLin,5.0,"Worth visiting, love how they manage the place by having different theme at certain seasons, been there for the Sakura and Tulipmania. Worth to get the annual pass to have unlimited visits.",14/01/24,4,https://sg.trip.com/review/gardens-by-the-bay-94795-180422097?locale=en-SG,Garden by the bay,True
Anonymous User,5.0,"The booking process is seamless and convenient , redemption process is also easy . The destination is very crowded and did not really enjoy the scenery .",07/01/24,3,https://sg.trip.com/review/gardens-by-the-bay-94795-180303872?locale=en-SG,Garden by the bay,True
Jarvi Fung,5.0,I went to the Flower Dome and Cloud Forest on 28/12/2023 with my aunt and mother. I would give an overall grade &ldquo;A+&rdquo; for Gardens by the Bay,29/12/23,3,https://sg.trip.com/review/gardens-by-the-bay-94795-180219901?locale=en-SG,Garden by the bay,True
Zatiey Aziz,5.0,"Gardens by the Bay in Singapore is a stunning horticultural attraction featuring iconic Supertrees, Flower Dome, and Cloud Forest. Visitors often praise its futuristic design, captivating light shows, and diverse plant collections. The unique blend of nature and technology creates a memorable experience for tourists and locals alike.",26/11/23,5,https://sg.trip.com/review/gardens-by-the-bay-94795-179921492?locale=en-SG,Garden by the bay,True
