username,rating,content,time,image,UserURL,Attraction,is_english
Joon Chai,5.0,Lovely National Park of Singapore no only is a great spot for breeding unique species of orchids that named after key leaders from various countries but also a wonderful place for locals and tourists to have great morning &amp; evening exercise and fond memories of amazing scenes &amp; fresh air.,25/01/24,5,https://sg.trip.com/review/singapore-botanic-gardens-76133-180506062?locale=en-SG,Botanic Garden,True
Suha Ridzwan,5.0,"Definitely worth a visit in Singapore.Allow sufficient time to walk and enjoy various sections of the garden, do not miss the Orchid garden. It is truly amazing. Try to avoid visiting at peak heat so around 12-3 but the orchid garden does have an air condition ed zone as well",24/01/24,3,https://sg.trip.com/review/singapore-botanic-gardens-76133-180504919?locale=en-SG,Botanic Garden,True
Chris Ong KC,5.0,"UNESCO acclaimed SBG Singapore Botanuc Gardens, in my humble view, is one of the highlights in visiting Singapore. Even for me a real local chap, SBG is part of my life since young. My parents took me there and we made some memorable photos. My NS days were spent in Minden Rd so I would strill in SBG every lunch time. Then my love for photography again takes me down frequently. It is as beautiful late night as it is in day time. I love the grand old trees, the orchids, the lake, the swans, the BANDSTAND!Nothing beats SBG in my heart.",15/01/24,9,https://sg.trip.com/review/singapore-botanic-gardens-76133-180425078?locale=en-SG,Botanic Garden,True
Em_em,5.0,"I&#39;d love to write a review about Singapore Botanic Gardens for you. Singapore Botanic Gardens is an absolute gem nestled in the heart of the city. It&#39;s a lush and sprawling park that offers a serene escape from the urban hustle and bustle. The gardens are beautifully landscaped with a wide variety of plants, flowers, and trees, making it a paradise for nature lovers and photographers alike. Whether you want to take a leisurely stroll, have a picnic, or simply relax in the tranquility of nature, Singapore Botanic Gardens has something for everyone. Don&#39;t miss the iconic National Orchid Garden, which showcases a stunning collection of orchids. It&#39;s definitely a must-visit when you&#39;re in Singapore! Have you had the chance to explore Singapore Botanic Gardens? 🌿🌺🌳",09/01/24,9,https://sg.trip.com/review/singapore-botanic-gardens-76133-180355957?locale=en-SG,Botanic Garden,True
Roden Berdin,5.0,A nice and relaxing place to go. Enjoy the freshness of air and a nature full of flowers and adventure maze!,23/12/23,7,https://sg.trip.com/review/singapore-botanic-gardens-76133-180147725?locale=en-SG,Botanic Garden,True
Jess Oh Pa,5.0,Singapore Botanic Gardens- dec 2023 The park is absolute stunning a guess what? it is free... 🥳🥳we love spending our time here exploring especially the swan lake. it is beyond amazing... it has lots of interesting flora too. amazing...,22/12/23,4,https://sg.trip.com/review/singapore-botanic-gardens-76133-180141827?locale=en-SG,Botanic Garden,True
Nero2022,5.0,Close to river and the marina bay which invites for a nice walk to the park while heading to the gardens and famous trees.,28/12/23,4,https://sg.trip.com/review/singapore-botanic-gardens-76133-180214901?locale=en-SG,Botanic Garden,True
Pinky lay,5.0,nice place to visit and relax. many good restaurants around there. recommend.,22/12/23,6,https://sg.trip.com/review/singapore-botanic-gardens-76133-180141010?locale=en-SG,Botanic Garden,True
SaNa Ullah@,5.0,"The gardens are divided into several sections, each with its own unique theme and features. The National Orchid Garden is a must-visit, with over 1,000 species of orchids on display, including the national flower of Singapore, the Vanda Miss Joaquim. The gardens also offer several walking trails, including the Rainforest Walk and the Evolution Garden Trail, providing visitors with the opportunity to explore the lush greenery and learn about the biodiversity of the region.",18/01/24,3,https://sg.trip.com/review/singapore-botanic-gardens-76133-180440609?locale=en-SG,Botanic Garden,True
NohYar,4.0,"The place is chill with alots of tress, suitable to go park picnic with family or friends have lots of soace to play around. Pets can be bring too. And can see some animals and insects roaming around.",07/01/24,9,https://sg.trip.com/review/singapore-botanic-gardens-76133-180329127?locale=en-SG,Botanic Garden,True
_TI***cw,4.0,"The scenery is pretty good, although it was raining when I went, but the feeling is great. There are a lot of different types of flowers, leaves, and trees. This place is good if you don&#39;t mind walking for about an hour as there&#39;s a distance between the exit and the orchid garden.",31/12/23,9,https://sg.trip.com/review/singapore-botanic-gardens-76133-180238773?locale=en-SG,Botanic Garden,True
Fenny Wu,5.0,"The Singapore Botanic Gardens is a true horticultural gem. With its lush greenery, meticulously maintained landscapes, and a remarkable collection of flora, it&#39;s a tranquil escape from the city&#39;s hustle and bustle. The National Orchid Garden within is a particular highlight, showcasing an extraordinary array of orchid species. It&#39;s not just a garden but a testament to Singapore&#39;s commitment to preserving its natural beauty. Whether you&#39;re a nature enthusiast, a casual visitor, or a photographer seeking inspiration, the Botanic Gardens offers an enchanting experience that&#39;s both educational and relaxing. A must-visit for anyone in Singapore.",06/12/23,5,https://sg.trip.com/review/singapore-botanic-gardens-76133-180003559?locale=en-SG,Botanic Garden,True
watching your smiles,4.0,There&#39;s What a beautiful natural garden that we can enjoying freshness air in the pure garden exist.,01/01/24,9,https://sg.trip.com/review/singapore-botanic-gardens-76133-180269299?locale=en-SG,Botanic Garden,True
VeraFindingWonders,5.0,"A visit to a botanical garden is a must if you&#39;re a nature&#39;s lover!Getting to this place is easy with the very efficient subway system in Singapore. It&#39;s a free entrance and it&#39;s such a big area with so much to see and to admire. A picnic day in this garden would be amazing, or you can just simply sit down and enjoying the breeze by all the lush greeneries around. It&#39;s really a lovely place to go, out of the busyness of the city! Recommended.",08/01/24,2,https://sg.trip.com/review/singapore-botanic-gardens-76133-180351222?locale=en-SG,Botanic Garden,True
Thanusha,5.0,"The Singapore Botanic Gardens captivates with its lush greenery, a sanctuary of serenity amidst the urban bustle. The National Orchid Garden is a highlight, boasting an exquisite array of orchids that paint a vibrant tapestry. Strolling through the swaying palm trees and tranquil lakes is a therapeutic escape. The heritage trees stand as silent witnesses to time, creating a perfect blend of nature and history. It&#39;s a botanical haven that seamlessly weaves beauty, biodiversity, and cultural significance. A must-visit gem in the heart of Singapore.",03/01/24,2,https://sg.trip.com/review/singapore-botanic-gardens-76133-180286550?locale=en-SG,Botanic Garden,True
Ppei,4.0,"A stunning beautiful place, a place to wander and explore all the amazing fauna attributed to the region. Lots of history to be discovered. A must visit.",02/01/24,4,https://sg.trip.com/review/singapore-botanic-gardens-76133-180276456?locale=en-SG,Botanic Garden,True
Floraaaa,5.0,"it&rsquo;s a very nice place to have a walk, very big can also have a picnic there. you also can see couples taking photos around.",01/01/24,2,https://sg.trip.com/review/singapore-botanic-gardens-76133-180274494?locale=en-SG,Botanic Garden,True
JY~,5.0,"Admire the tranquil, serene yet beautiful nature park at our own Singapore botanical garden! Easily accessible at botanic garden mrt along circle line!",30/12/23,2,https://sg.trip.com/review/singapore-botanic-gardens-76133-180224930?locale=en-SG,Botanic Garden,True
Zira Hsan,4.0,"Beautiful gardens! We had a lovely time walking through the gardens and the orchid section. There is a lot of birdlife here. It was extremely hot in the middle of the day, &amp; most people appeared to be in discomfort. So bring a hat and sunscreen. There is an air-conditioned section at the end of the National Orchid Gallery, which was a great break after roaming around for a while.",26/12/23,4,https://sg.trip.com/review/singapore-botanic-gardens-76133-180194149?locale=en-SG,Botanic Garden,True
_TI***lz,5.0,its an very amazing place to spent a time with family or friends. very beautiful and quite place. Good for the childrens to play. can make picninc bring the food and eat. I love to visit again and again.,24/12/23,2,https://sg.trip.com/review/singapore-botanic-gardens-76133-180155473?locale=en-SG,Botanic Garden,True
_TX***ae,5.0,My husband and I recently went to the botanic gardens in Singapore this year me absolutely loved it. it&rsquo;s a stunning feat of architecture and lighting and the evening has a lighting show every day with music the whole experience was fantastic.,29/11/23,8,https://sg.trip.com/review/singapore-botanic-gardens-76133-179939953?locale=en-SG,Botanic Garden,True
Særa Bellä,5.0,"Magnificent gardens! We had a great walk through the gardens and also through the orchid section. There is good bird life here. It is very warm during the middle of the day, and most people looked like they were suffering a bit. So bring a hat, and some suncream. At the end of the National orchid gallery, there is an air-conditioned area and that was a welcome relief after walking around for awhile.",21/11/23,7,https://sg.trip.com/review/singapore-botanic-gardens-76133-179861329?locale=en-SG,Botanic Garden,True
JayelJL,5.0,"*Less talk about hidden gem*Singapore Botanic Gardens is a very less talk about places to go among tourists. Most would visit Gardens by the Bay, MBS, Merlion Park, Little India, Chinatown etc. Therefore if you wish to avoid the crowd or take an unconventional route, try out Singapore Botanical Gardens. Lots of flora and fauna and beautiful spots where you can take photos. You can choose to either walk around, visit the National Orchids Garden, have a picnic or do some yoga. If you&rsquo;re lucky, you will also be able to spot some otters. Occasionally there are events going on which make the experience of visiting the Gardens even better!",16/11/23,6,https://sg.trip.com/review/singapore-botanic-gardens-76133-179799182?locale=en-SG,Botanic Garden,True
Lucys_travel_page,5.0,"The gardens are so beautiful and well looked after, especially the orchard garden. I would definitely recommend visiting here for a stroll around.",16/11/23,5,https://sg.trip.com/review/singapore-botanic-gardens-76133-179796762?locale=en-SG,Botanic Garden,True
JõjôMyojo,5.0,Singapore Botanic Gardens is world renowned as it is UNESCO World Heritage Site. There are many plants &amp; beautiful flowers planted in its gardens where their orchird garden is a must visit place when you go to this world heritage site. They even have an amphitheatre that hosted some popular &amp; renowned artistes who performed at their amphitheatre. Botanic Gardens is sure great place for picnic too with listening to the concert performances while picnicking makes it a great family &amp; friends outing venue too.,11/11/23,9,https://sg.trip.com/review/singapore-botanic-gardens-76133-179738768?locale=en-SG,Botanic Garden,True
_TI***k6,5.0,"When you live in Singapore, of course you will be very happy if you can take a short escape to a green place like the Botanic Gardens!Botanic Gardens has a very pleasant atmosphere, you can exercise, you can spend time with family or friends, you can also have a picnic here.Botanic Gardens has a very large area, you can walk from the Botanic Gardens MRT side, to the exit at the Tanglin area, which is quite close to the Orchard area.I highly recommend Singaporeans and tourists visiting Singapore to visit the Botanic Gardens and enjoy its beauty.",26/10/23,5,https://sg.trip.com/review/singapore-botanic-gardens-76133-179542191?locale=en-SG,Botanic Garden,True
Alice Bun,5.0,"good place for picnic and friends, family gathering! you don&rsquo;t worry to sit under the hot Sun cause there is shelter everywhere, enjoy the beauty of nature green!there is National Orchid Garden where show case spectacular tropical plants especially Orchids species,  worth visiting if you&rsquo;re flower lovers. #UNESCOHeritage",26/10/23,0,https://sg.trip.com/review/singapore-botanic-gardens-76133-179536994?locale=en-SG,Botanic Garden,True
_TI***bc,5.0,"Singapore Botanic Gardens is a UNESCO World Heritage site, renowned for its breathtaking beauty. This lush oasis in the heart of the city features a vast collection of orchids, including the national flower, the Vanda &#39;Miss Joaquim.&#39; Stroll through the tranquil gardens, enjoy the Symphony Lake, and immerse yourself in the harmonious coexistence of nature and urban life, making it a must-visit in Singapore.",22/10/23,0,https://sg.trip.com/review/singapore-botanic-gardens-76133-179465684?locale=en-SG,Botanic Garden,True
Nong Phonethida,5.0,Magnificent gardens!There were various locations within the gardens that served as beautiful photo spots.,23/10/23,0,https://sg.trip.com/review/singapore-botanic-gardens-76133-179512337?locale=en-SG,Botanic Garden,True
_TI***06,5.0,Perfect walk with friends - lush greenery and even saw a giant monitor lizard? (would have uploaded a video but platform doesn&rsquo;t allow). There&rsquo;s also an orchid garden within with free entry during certain occasions.,15/12/23,0,https://sg.trip.com/review/singapore-botanic-gardens-76133-180078568?locale=en-SG,Botanic Garden,True
AuntieFei,4.0,Fun gathering at Singapore Botanic Gardens. with some entertainment and pot luck food served. love it!,20/01/24,0,https://sg.trip.com/review/singapore-botanic-gardens-76133-180452023?locale=en-SG,Botanic Garden,True
Ningning25,5.0,Very nice to walk here as it it so green and calming. Recommend to go with family and partner. It was great!,27/12/23,0,https://sg.trip.com/review/singapore-botanic-gardens-76133-180207432?locale=en-SG,Botanic Garden,True
IsabelleRuth,5.0,"The biggest park in Singapore... Great for running, walking and spending time in nature.",05/11/23,0,https://sg.trip.com/review/singapore-botanic-gardens-76133-179654060?locale=en-SG,Botanic Garden,True
JennySu,5.0,"perfect for tekking and picnic with family. the place is so huge that you can do anything with your family. it has a swan place, playground and sooo relaxing.",04/02/24,0,https://sg.trip.com/review/singapore-botanic-gardens-76133-180599210?locale=en-SG,Botanic Garden,True
PabloSlab,5.0,The Singapore Botanic Gardens are absolutely magical and I was lost in awe while visiting here. Would highly recommend visiting such an amazing venue.,23/01/24,0,https://sg.trip.com/review/singapore-botanic-gardens-76133-180499452?locale=en-SG,Botanic Garden,True
_TI***ik,5.0,"The Botanic Garden in Singapore is a mesmerizing oasis of natural beauty. Lush greenery, vibrant orchids, and serene lakes create a captivating atmosphere. The well-maintained paths invite peaceful strolls, making it a perfect escape from the city&#39;s hustle. With its diverse plant collections and tranquil ambiance, the garden offers a delightful experience for nature enthusiasts and a must-visit destination in Singapore.",22/01/24,0,https://sg.trip.com/review/singapore-botanic-gardens-76133-180492585?locale=en-SG,Botanic Garden,True
Prasant Kumar Chowdhury,5.0,Such a wonderful place for walking and taking in the fresh smells. The vegetation and layout is extensive and exquisite. As soon as we entered the gardens we were greeted by the sight of a very handsome cockerel strutting about! I could have spent the day here but time was very limited on my 2 day visit to Singapore.,19/01/24,0,https://sg.trip.com/review/singapore-botanic-gardens-76133-180447153?locale=en-SG,Botanic Garden,True
_TX***vz,5.0,"The Gardens has been inscribed as a UNESCO World Heritage Site in 2015. The Gardens is the first and only tropical botanic garden on the UNESCO&rsquo;s World Heritage List. Today, the Gardens is an important botanical institute.",19/01/24,0,https://sg.trip.com/review/singapore-botanic-gardens-76133-180446291?locale=en-SG,Botanic Garden,True
Travelmaster,5.0,this is indeed a fantastic garden &amp; its lovely!! great for strolling &amp; especially morning walk!! Great place of interest! love this place so much!!,18/01/24,0,https://sg.trip.com/review/singapore-botanic-gardens-76133-180440624?locale=en-SG,Botanic Garden,True
Niaz Morshed 1811,5.0,"Immerse yourself in nature&#39;s masterpiece at Singapore Botanic Gardens. A lush oasis in the heart of the city, it showcases diverse flora, serene lakes, and enchanting pathways. Explore the Orchid Garden and soak in the vibrant beauty that makes this UNESCO World Heritage site a horticultural haven.",12/01/24,0,https://sg.trip.com/review/singapore-botanic-gardens-76133-180369736?locale=en-SG,Botanic Garden,True
Hotel Review,5.0,Beautiful garden in the heart of Singapore. It is such a large park including access to the National University of Singapore and also access to bus stops that runs directly to Orchard Road. Ticket price is reasonable. The park is very clean and open to all ages.,10/01/24,0,https://sg.trip.com/review/singapore-botanic-gardens-76133-180361202?locale=en-SG,Botanic Garden,True
chikicsc,5.0,"The Singapore Botanic Gardens exceeded my expectations with its lush greenery, vibrant blooms, and serene atmosphere. The well-maintained paths and informative signage made exploring the diverse plant collections a delightful experience. The National Orchid Garden was a highlight, showcasing an impressive array of orchid species. The garden&#39;s historical significance and the swan-filled Symphony Lake added an extra layer of charm. A must-visit for nature enthusiasts and those seeking a peaceful escape in the heart of the city.",09/01/24,0,https://sg.trip.com/review/singapore-botanic-gardens-76133-180356088?locale=en-SG,Botanic Garden,True
Inspiretion,5.0,"The Singapore Botanic Gardens, established in 1859, is a lush oasis in the heart of the city. Renowned for its rich biodiversity, the gardens house over 10,000 species of plants. Visitors can explore themed gardens, marvel at the National Orchid Garden, and enjoy the tranquility of this UNESCO World Heritage Site.",06/01/24,0,https://sg.trip.com/review/singapore-botanic-gardens-76133-180302436?locale=en-SG,Botanic Garden,True
jils,4.0,"A very beautiful series of gardens in the heart of Singapore. Do visit the National Orchird Garden nestled within that boasts many exotic/rare orchirds.There&#39;s also many open areas by the lakeside, great for picnics. Great for jogging too if you&#39;re looking for a beautiful serene environment to take a breather!",05/01/24,0,https://sg.trip.com/review/singapore-botanic-gardens-76133-180296391?locale=en-SG,Botanic Garden,True
The Soul Traveler,5.0,"Hands down, one of my favorite places to enjoy nature and get out of the city while in Singapore. Free entrance for all and lovely walks and gardens to pass through. The perfect place for hanging out with friends, playing sports, having a picnic, or curling up under a tree with a good book. I went with my dad while we were traveling in Singapore and we spent a few hours talking and enjoying the beautiful gardens.",02/01/24,0,https://sg.trip.com/review/singapore-botanic-gardens-76133-180282258?locale=en-SG,Botanic Garden,True
kohweile,5.0,"The Singapore Botanic Gardens is a lush oasis that captivates visitors with its vibrant flora and tranquil landscapes. The meticulously curated collection of plants, including the iconic National Orchid Garden, offers a delightful feast for the senses. The well-maintained paths lead to picturesque spots like Swan Lake and the Healing Garden, creating a serene atmosphere for leisurely strolls. The educational aspects, such as the Evolution Garden, add depth to the experience. Overall, the Singapore Botanic Gardens stands as a horticultural masterpiece, blending natural beauty with cultural significance.",30/12/23,0,https://sg.trip.com/review/singapore-botanic-gardens-76133-180236241?locale=en-SG,Botanic Garden,True
crystqlsim,5.0,"a UNESCO World Heritage Site that I can proudly say is from my country. Even as a local, I find myself visiting this place often! here is a picture that is taken  at National Orchid Garden.",29/12/23,0,https://sg.trip.com/review/singapore-botanic-gardens-76133-180215701?locale=en-SG,Botanic Garden,True
_TI***1b,5.0,"an ideal place for naturalists, the plants are really wonderful and the park is well organized. The place is clean , and the air is fresh. There&#39;s a lot of animals crossing here and there without getting bothered by tourists which show the peaceful interaction between human and the animals. Rlly love the flora and fauna there, a good place for photos too!",27/12/23,1,https://sg.trip.com/review/singapore-botanic-gardens-76133-180205990?locale=en-SG,Botanic Garden,True
Shajaanmuazshaheem,5.0,"Visiting the Botanic Gardens in Singapore was an incredibly cool experience. The lush greenery, vibrant flowers, and serene atmosphere made it a perfect escape from the bustling city. The variety of plants and the beautifully landscaped gardens were a treat for the eyes. A must-visit for nature lovers and anyone seeking tranquility in Singapore.",26/12/23,1,https://sg.trip.com/review/singapore-botanic-gardens-76133-180196570?locale=en-SG,Botanic Garden,True
mirrzzza,5.0,"Really beautiful location. I cannot believe this whole park is free. Such a gem. We loved spending a few hours here. Lots of monitor lizards, a few swans, and many turtles. There is just about every plant imaginable, and the orchids and flowers are beyond amazing.",24/12/23,1,https://sg.trip.com/review/singapore-botanic-gardens-76133-180183521?locale=en-SG,Botanic Garden,True
Boy Beckham,5.0,"It is a really nice place to visit and get more information, knowledge and experience the real life botanic system..we can teach our children&#39;s how to love the earth.of course I  and my family will come again when we are in Singapore in the next time..until we see you again..really love to come here. so calm and relaxing. congratulations to Singapore Botanic Gardens because g8ve me this great experience..",22/12/23,1,https://sg.trip.com/review/singapore-botanic-gardens-76133-180147309?locale=en-SG,Botanic Garden,True
Safaa Maretha,5.0,The Singapore Botanical Gardens is one of three botanical gardens included in the&nbsp;UNESCO World Heritage Site.  This place is suitable for those who want to take a relaxing walk.  Getting here is also super easy.  Just enter the MRT then look for the green line where there is the MRT Botanic Garden or Kebon Bunga.  The instructions are very clear.,21/12/23,1,https://sg.trip.com/review/singapore-botanic-gardens-76133-180134176?locale=en-SG,Botanic Garden,True
Japonamama,5.0,"The Singapore Botanic Gardens is a captivating oasis that seamlessly blends lush greenery with botanical wonders. Its expansive grounds offer a serene escape from the urban bustle, featuring a diverse collection of plants, orchids, and vibrant blooms. The National Orchid Garden within is a highlight, showcasing a breathtaking array of orchid species. The well-maintained paths invite leisurely strolls, while the Symphony Lake adds a charming touch with occasional performances. Whether you&#39;re a nature enthusiast or seeking a tranquil retreat, the Singapore Botanic Gardens is a horticultural gem that captivates visitors with its beauty and biodiversity.",10/12/23,4,https://sg.trip.com/review/singapore-botanic-gardens-76133-180054585?locale=en-SG,Botanic Garden,True
May Linn,5.0,It is a great place to realx. You can see different types of plants and trees there. Also you can see some animals passing there. The best thing is that the entrance is free!,21/11/23,4,https://sg.trip.com/review/singapore-botanic-gardens-76133-179859728?locale=en-SG,Botanic Garden,True
Pleasuremind,5.0,The gardens are free to enter. The best time to visit the Singapore Botanic Garden is early in the morning or late afternoon because it can be very hot during the day.,28/10/23,4,https://sg.trip.com/review/singapore-botanic-gardens-76133-179558423?locale=en-SG,Botanic Garden,True
Nicky meow,5.0,"beautiful place attracted us all to spend almost whole day there ! we had so much fun and awe moments to see all the breathtaking flowers and structures, the food atmosphere which blend in much of the botanical theme is just incredible!",25/10/23,4,https://sg.trip.com/review/singapore-botanic-gardens-76133-179533032?locale=en-SG,Botanic Garden,True
_TI***t6,5.0,breathtaking view. enjoyed every single moment there. even 3 hours was not enough to explore the whole park. so much to explore and enjoy.,22/10/23,4,https://sg.trip.com/review/singapore-botanic-gardens-76133-179510807?locale=en-SG,Botanic Garden,True
Bobo0692,5.0,My favourite place to go for a workout! There are also concerts (which are usually free of charge) happening from time to time. The whole compound is huge and there are so many different gardens for you to explore.,21/10/23,4,https://sg.trip.com/review/singapore-botanic-gardens-76133-179463407?locale=en-SG,Botanic Garden,True
Diyanah rahman,5.0,"Been there for a few times for some family time,picnics and hanging out with friends. Such a beautiful place.",25/12/23,1,https://sg.trip.com/review/singapore-botanic-gardens-76133-180186841?locale=en-SG,Botanic Garden,True
_TX***k3,5.0,"one of my favourite place to healing. Suitable for all. Relaxing,walks and jogging.",25/10/23,7,https://sg.trip.com/review/singapore-botanic-gardens-76133-179532508?locale=en-SG,Botanic Garden,True
