username,rating,content,time,image,UserURL,Attraction,is_english
Veen0mz,5.0,went to see baby lele but he did not come out :((,30/05/22,9,https://sg.trip.com/review/river-wonders-98700-170858172?locale=en-SG,River Wonder,True
Travelspo,5.0,River Wonder was very cooling and panda was cute. Will visit again,06/05/23,1,https://sg.trip.com/review/river-wonders-98700-175759306?locale=en-SG,River Wonder,True
snub,4.0,good place to see,14/10/23,0,https://sg.trip.com/review/river-wonders-98700-179377054?locale=en-SG,River Wonder,True
emilywonglf,5.0,"I had a great time at river safari, very lovetly place. taking the boat ride was the most pleasant experience!",15/04/22,2,https://sg.trip.com/review/river-wonders-98700-170271272?locale=en-SG,River Wonder,True
Miss_,4.0,So convenient to visit here. Here is one of the most famous tourists spots. really so attractive. must visit,17/05/23,1,https://sg.trip.com/review/river-wonders-98700-175868653?locale=en-SG,River Wonder,True
Gabzz,5.0,"the best wild life preservations i have ever seen, the place is clean and in order.",16/01/23,3,https://sg.trip.com/review/river-wonders-98700-174605554?locale=en-SG,River Wonder,True
Littleflock,5.0,My toddler really enjoy watching all the river animals! Loved pandas so much!,17/05/23,0,https://sg.trip.com/review/river-wonders-98700-175866835?locale=en-SG,River Wonder,True
Imm_diaries,5.0,"Exploring the rivers of Singapore is a captivating and immersive experience. As you embark on a journey along the Singapore River, you&#39;ll witness the city&#39;s rich history, stunning architecture, and vibrant culture come to life. You can take a leisurely boat cruise or walk along the river&#39;s banks, enjoying the scenic views and the iconic landmarks that line its shores. The river offers a unique perspective of Singapore, with a blend of old and new as you pass by historic sites like Clarke Quay, Boat Quay, and the iconic Merlion statue, as well as modern marvels like the Marina Bay Sands and the futuristic skyline. Along the way, you&#39;ll encounter bustling waterfront restaurants, cafes, and shops, offering a vibrant atmosphere day and night. Whether you&#39;re a history enthusiast, a food lover, or simply seeking a memorable way to explore the city, the Singapore River presents a delightful experience that captures the essence and charm of Singapore.",29/06/23,2,https://sg.trip.com/review/river-wonders-98700-177297000?locale=en-SG,River Wonder,True
Fajar Nurohman,5.0,"Such a cool experience! We hopped on a boat ride that allowed us to spot many animals along the way. It was a lot of fun.There were so many interesting river fish to see and learn about here. We also saw some land animals including pandas, monkeys, and a very cute capybara.",12/06/23,2,https://sg.trip.com/review/river-wonders-98700-176229459?locale=en-SG,River Wonder,True
Aravinthan,5.0,Very nice tour. The enclosure don&#39;t seem too small for the animals. The pandas were a marvel to watch... Get there early so the temperature is not too bad.,09/01/23,1,https://sg.trip.com/review/river-wonders-98700-174546382?locale=en-SG,River Wonder,True
YenggneY,5.0,One of the best place to see in Singapore. Place were all ages can enjoy. Clearly maintained and well organized.As a tourist we need to help aquarium people to maintain harmony and should not disturb co tourists. You can see a great variety of marine fishes. Qudos to people&#39;s who maintain the water clarity. Try to reach early so you can spend more than half a day to cover whole place.,24/10/22,1,https://sg.trip.com/review/river-wonders-98700-173279789?locale=en-SG,River Wonder,True
angguniani,5.0,"Good place to come with family. Been here for a few times, since my daughter is really lobe anything about Panda. Everytime we come to Singapore, she always want to see XaiXai, JiaJia, and LeLe",12/10/22,1,https://sg.trip.com/review/river-wonders-98700-173090996?locale=en-SG,River Wonder,True
M_Sedik,5.0,"Amazing experience at the River Wonders. Got to see Manatees, Pandas, and many other fascinating animals. Well designed with friendly guides throughout the park. Highly recommended especially with kids. Educational and healthy day out 😍",10/09/22,1,https://sg.trip.com/review/river-wonders-98700-172588513?locale=en-SG,River Wonder,True
The Traveling Connoisseur,5.0,"River Wonders in Mandai, Singapore is truly a gem as a natural wildlife park! Interesting and fun for those passionate about nature and animals. Enjoy!",26/08/22,1,https://sg.trip.com/review/river-wonders-98700-172363088?locale=en-SG,River Wonder,True
shadowran,5.0,"River Wonders, formerly known as River Safari, is a river-themed zoo and aquarium located in Mandai, Singapore, forming part of the Mandai Wildlife Reserve. It is built over 12 hectares (30 acres) and nestled between its two counterparts, the Singapore Zoo and the Night Safari, Singapore.It is the first of its kind in Asia and features freshwater exhibits and a river boat ride as its main highlights. The safari was built at a cost of S$160m, with an expected visitor rate of 820,000",21/08/22,1,https://sg.trip.com/review/river-wonders-98700-172264376?locale=en-SG,River Wonder,True
rantirnp,5.0,"River Wonders, formerly known as River Safari, is a river-themed zoo and aquarium located in Mandai, Singapore, forming part of the Mandai Wildlife Reserve. It is built over 12 hectares (30 acres) and nestled between its two counterparts, the Singapore Zoo and the Night Safari, Singapore.It is the first of its kind in Asia and features freshwater exhibits and a river boat ride as its main highlights. The safari was built at a cost of S$160m, with an expected visitor rate of 820,000 people yearly.",20/08/22,1,https://sg.trip.com/review/river-wonders-98700-172238624?locale=en-SG,River Wonder,True
Ramdankurniawan21,5.0,"River Wonders, formerly known as&nbsp;River Safari,&nbsp;is a river-themed&nbsp;zoo&nbsp;and&nbsp;aquarium&nbsp;located in Mandai,&nbsp;Singapore, forming part of the&nbsp;Mandai Wildlife Reserve. It is built over 12 hectares (30 acres) and nestled between its two counterparts, the&nbsp;Singapore Zoo&nbsp;and the&nbsp;Night Safari, Singapore.[2]&nbsp;It is the first of its kind in&nbsp;Asia&nbsp;and features freshwater exhibits and a river boat ride as its main highlights. The safari was built at a cost of&nbsp;S$160m, with an expected visitor rate of 820,000 people yearlyThe Giant Panda Forest was opened to the public on 29 November 2012,[6] with a soft opening on 3 April 2013, attracting close to 1,500 visitors.[7] This attraction is the fourth zoo in Singapore, along with the Singapore Zoo, Jurong Bird Park, and Night Safari, all of which are managed by Mandai Wildlife Reserve. The park was officially opened on 28 February 2014, and it was announced that more than 1.1 million have visited River Safari since its soft opening in April 2013.",12/08/22,1,https://sg.trip.com/review/river-wonders-98700-172072085?locale=en-SG,River Wonder,True
keyo,5.0,"River Wonders (formerly River Safari), Asia&#39;s first and only river-themed wildlife park. Buy tickets and plan your trip*googled",12/07/22,1,https://sg.trip.com/review/river-wonders-98700-171506162?locale=en-SG,River Wonder,True
Yadi Thai,5.0,The story of River Safari&nbsp;began in 1996 when it was thought the exhibit would be a freshwater aquarium which would complement the zoo and Night Safari. This idea eventually grew into the idea of the Amazon Flooded Forest habitat.,01/04/22,1,https://sg.trip.com/review/river-wonders-98700-170106585?locale=en-SG,River Wonder,True
Zaizai,5.0,Went on a weekday and is less crowded. Went to the Panda Forest too. Baby Lele is growing up already with cute behaviour.,01/07/23,2,https://sg.trip.com/review/river-wonders-98700-177387423?locale=en-SG,River Wonder,True
teleinna0214,5.0,Easy access to everything. Book from here and no worries ar all..😍,13/02/23,0,https://sg.trip.com/review/river-wonders-98700-174896866?locale=en-SG,River Wonder,True
Ace_Grace,5.0,The most nice place to see big aquarium with kids. But always keep the children close to you,13/06/22,2,https://sg.trip.com/review/river-wonders-98700-171048525?locale=en-SG,River Wonder,True
Chia Yie,4.0,"Would be better if the duration of boat ride is longer, great but a bit short",10/05/23,1,https://sg.trip.com/review/river-wonders-98700-175799313?locale=en-SG,River Wonder,True
Yanfi,5.0,"It was great, it has a big aquarium bt i didnt took a pic with...so far overall is good...",20/11/22,2,https://sg.trip.com/review/river-wonders-98700-173728702?locale=en-SG,River Wonder,True
TeamLT Daily,5.0,Nice place to spend time with family.  Rain or shine you can explore this place since most areas are covered.,26/07/22,1,https://sg.trip.com/review/river-wonders-98700-171764641?locale=en-SG,River Wonder,True
Jacelyn Ong,5.0,The redemption of the ticket is easy. You can do it online.,26/03/23,0,https://sg.trip.com/review/river-wonders-98700-175302539?locale=en-SG,River Wonder,True
_GG***32,5.0,wonderful curation of animals and lovely exhibits!,08/05/23,0,https://sg.trip.com/review/river-wonders-98700-175773017?locale=en-SG,River Wonder,True
_TT***94,5.0,Have a wonderful time with my son. The pandas so cute!,03/04/23,0,https://sg.trip.com/review/river-wonders-98700-175388974?locale=en-SG,River Wonder,True
Bbear.,5.0,"Worth a visit, especially for families! Mostly air conditioned, with some fun animals! Highly recommend the Amazon River Quest ride, it was the most fun and memorable- aside from the pandas! I wouldn&rsquo;t probably go here again, maybe in 10 years?",17/07/23,1,https://sg.trip.com/review/river-wonders-98700-177635742?locale=en-SG,River Wonder,True
Anonymousxx,5.0,"River Wonders in Singapore is a captivating experience that showcases the vibrant beauty and rich history of the city&#39;s waterways. With its scenic riverfront views, stunning architecture, and cultural landmarks, it offers a delightful journey through Singapore&#39;s heritage. Whether you&#39;re taking a river cruise, strolling along the promenade, or enjoying the dazzling light shows, River Wonders provides a mesmerizing and unforgettable glimpse into the heart of Singapore.",10/07/23,1,https://sg.trip.com/review/river-wonders-98700-177539709?locale=en-SG,River Wonder,True
Solo23Travelers,5.0,"worth a visit, especially for families. Mostly air conditioned, with some fun animals! It was nice to see and learn more about aquatic creatures.",04/07/23,1,https://sg.trip.com/review/river-wonders-98700-177469458?locale=en-SG,River Wonder,True
RS8700,5.0,River Wonders is wonderful for a family trip. The scenery and layout of the place makes it easy and relaxing for families to enjoy on their day out. Children can also enjoy plenty of activities.,04/07/23,1,https://sg.trip.com/review/river-wonders-98700-177469234?locale=en-SG,River Wonder,True
akmal15,5.0,Amazing experience. Recommend going early in the morning during the week to avoid the heat and it also happens to be feeding time roughly at 12. all the animals will come out to eat and you can see them in action. The show is decent. The boat tour is optional that seems to be more targeted at younger children,04/07/23,1,https://sg.trip.com/review/river-wonders-98700-177462853?locale=en-SG,River Wonder,True
Muhammad S,5.0,"The River Wonders Singapore, formerly known as the River Safari Singapore, is located on Mandai Lake Road, right next to Singapore Zoo. The nearest MRT is Khatib on the North-South Line or take bus from Choa Chu Kang MRT. Note that there is also the 926 bus (which connects from Woodlands and Marsiling MRT stations), but this is only available on Sundays and public holidays.",02/07/23,1,https://sg.trip.com/review/river-wonders-98700-177401710?locale=en-SG,River Wonder,True
Yorkshire visiting,5.0,"River Wonders is a great attraction in Singapore. The river cruise offers a unique and beautiful perspective of the city, with stunning views of the skyline and iconic landmarks. The tour guides are knowledgeable and provide interesting facts about the history and culture of Singapore. The location is also great, with easy access to other popular attractions in the area. However, it can get quite crowded, so I recommend booking your tickets in advance. Overall, I highly recommend River Wonders to anyone visiting Singapore.",01/07/23,1,https://sg.trip.com/review/river-wonders-98700-177388823?locale=en-SG,River Wonder,True
tang0912,5.0,"Singapore River Wonders is an incredible experience that captures the essence of Singapore&#39;s rich history, culture, and modernity. The river, which once served as a lifeline for trade and commerce, is now a bustling tourist destination with a plethora of attractions to explore.One of the highlights of the Singapore River Wonders is the River Cruise, which takes you on a relaxing journey along the river, allowing you to take in the stunning views of the city&#39;s skyline and the iconic landmarks that line the riverbanks. The commentary provided on the cruise is informative and engaging, providing insights into the history and significance of the various landmarks and bridges.r anyone visiting Singapore.",30/06/23,1,https://sg.trip.com/review/river-wonders-98700-177302224?locale=en-SG,River Wonder,True
WAI SING,5.0,River Wonders in Singapore is Asia&#39;s first and only river-themed wildlife park where you can know and discover animals and the river basins around the world.,28/06/23,1,https://sg.trip.com/review/river-wonders-98700-177266388?locale=en-SG,River Wonder,True
Cody Au Yong,5.0,"OmigoshieCutenessOverloadEpicPANDAmic!Panda Le Le (叻叻）baby times theraputic mugshot.Le Le (叻叻）is first giant panda cub borned to Kai Kai and Jia Jia at #riverwonders , Singapore. Birthday 14 August 2021.",24/06/23,1,https://sg.trip.com/review/river-wonders-98700-176859225?locale=en-SG,River Wonder,True
Zimik,5.0,"Singapore River Wonders is an absolute treasure, showcasing the rich history, vibrant culture, and breathtaking beauty of this enchanting city. As I strolled along the river&#39;s picturesque promenade, I was captivated by the seamless blend of modern architecture and preserved heritage buildings. The stunning skyline, reflected in the calm waters, created a mesmerizing sight. The riverfront is alive with activity, bustling with charming cafes, trendy restaurants, and vibrant nightlife spots. From the iconic Merlion Park to the bustling Clarke Quay, each landmark along the river tells a story and offers a unique experience. Singapore River Wonders is a must-visit, a captivating journey that reveals the heart and soul of this remarkable city.",12/06/23,1,https://sg.trip.com/review/river-wonders-98700-176231887?locale=en-SG,River Wonder,True
Pi Bongs,5.0,"The River Wonders in Singapore is a captivating showcase of the city&#39;s vibrant waterfront and its rich cultural heritage. Stretching along the Singapore River, this enchanting promenade takes visitors on a journey through time, offering stunning views, historical landmarks, and a vibrant atmosphere. From the iconic Merlion Park to the bustling Clarke Quay and Boat Quay, River Wonders immerses visitors in the city&#39;s unique blend of modernity and tradition. With its scenic riverfront walkways, charming cafes, and vibrant nightlife, it is a must-visit destination that highlights the dynamic spirit and charm of Singapore.",12/06/23,1,https://sg.trip.com/review/river-wonders-98700-176229878?locale=en-SG,River Wonder,True
cindy0604,5.0,"🌉🚤🎡🌃 River Wonders in Singapore will take your breath away! Cruise down the river and marvel at the city&#39;s iconic skyline, including the Marina Bay Sands and Singapore Flyer. As the sun sets, watch the city come alive with a dazzling light show. An unforgettable experience! 🌟🌃🎉 #RiverWonders #Singapore #CityLights",10/06/23,1,https://sg.trip.com/review/river-wonders-98700-176204800?locale=en-SG,River Wonder,True
Japonamama,5.0,"River Wonders, formerly known as River Safari, is a river-themed zoo and aquarium located in Mandai, Singapore, forming part of the Mandai Wildlife Reserve. We had a great time with our family last summer. the kids were astonished.",07/06/23,1,https://sg.trip.com/review/river-wonders-98700-176080178?locale=en-SG,River Wonder,True
FarhanMausek,3.0,"This place is superb, so much to see and great for a rainy day you can get around the entire attraction without getting wet. but singaporeans are rude",03/06/23,1,https://sg.trip.com/review/river-wonders-98700-176037878?locale=en-SG,River Wonder,True
minniesim,5.0,Quite a fun experience to visit river wonders again. Don&rsquo;t get to see le le as he is just sleeping inside his closure area. Will definitely visit again!,09/12/22,0,https://sg.trip.com/review/river-wonders-98700-174049883?locale=en-SG,River Wonder,True
Live life today,5.0,"Uncover over 7,500 amazing land and aquatic animals representing 240 species, love River wonders, a must go outdoor but pretty sheltered. seeing the pandas in cozy air conditioned area while learning about them. there&rsquo;s a boat ride you can try when you visit. peaceful and serene. If you want a pretty serene comfortable outdoor, consider River wonders!",29/08/22,0,https://sg.trip.com/review/river-wonders-98700-172411556?locale=en-SG,River Wonder,True
Fadil.Elnin,5.0,"River Wonders, formerly known as River Safari, is a river-themed zoo and aquarium located in Singapore. It is built over 12 hectares and nestled between its two counterparts, the Singapore Zoo and the Night Safari, Singapore.pla",01/04/22,0,https://sg.trip.com/review/river-wonders-98700-170106435?locale=en-SG,River Wonder,True
Michelle Darrough,5.0,looks amazing and a beautiful place to go to.,26/05/23,0,https://sg.trip.com/review/river-wonders-98700-175951588?locale=en-SG,River Wonder,True
hamzath ameen,5.0,"astonishing place, my dream vacation place",14/02/23,0,https://sg.trip.com/review/river-wonders-98700-174912765?locale=en-SG,River Wonder,True
Mrs See,5.0,love to visit with my family and friends. one of the most popular place in Singapore 🇸🇬🤩,14/01/23,1,https://sg.trip.com/review/river-wonders-98700-174592056?locale=en-SG,River Wonder,True
Nur05,5.0,got to see the panda and it was worth the word! would recommend going there! would go again!,03/04/22,1,https://sg.trip.com/review/river-wonders-98700-170134548?locale=en-SG,River Wonder,True
Angelin95,5.0,This is totally worth it! A must see is also the cute pandas at the Giant Panda Forest 😍,02/07/23,2,https://sg.trip.com/review/river-wonders-98700-177398694?locale=en-SG,River Wonder,True
Hazelthh73,5.0,the exhibitions were really insightful and I got to see many animals ! it was fun &amp; relaxing for families to go ~,14/06/23,1,https://sg.trip.com/review/river-wonders-98700-176249961?locale=en-SG,River Wonder,True
Seow Hui Min,5.0,panda !!!!!!! and fish and manatee :),01/11/22,3,https://sg.trip.com/review/river-wonders-98700-173422494?locale=en-SG,River Wonder,True
_TI***ow,5.0,loved this so up close to water life,18/05/23,0,https://sg.trip.com/review/river-wonders-98700-175872215?locale=en-SG,River Wonder,True
Theng女亭,5.0,Had a great time here with my family,12/02/23,0,https://sg.trip.com/review/river-wonders-98700-174893802?locale=en-SG,River Wonder,True
Hsu15,5.0,Visited to Man dai zoo and river wonders of Singapore. Very fun experience. Especially love the Sea Lion.,26/06/23,1,https://sg.trip.com/review/river-wonders-98700-177084373?locale=en-SG,River Wonder,True
Park Changho,5.0,The place is nice cool And enchanting is very suitable to visit with big family&#39;s.,08/10/22,1,https://sg.trip.com/review/river-wonders-98700-173033263?locale=en-SG,River Wonder,True
Traveltav,5.0,I really love this place and it is a very suitable place to bring your family as you can enjoy your time here,13/07/23,1,https://sg.trip.com/review/river-wonders-98700-177579022?locale=en-SG,River Wonder,True
Mylene Ong,4.0,saw some amazing animals! was a nice trip for a family outing. wished I had more time to take more photos!,16/06/23,3,https://sg.trip.com/review/river-wonders-98700-176307255?locale=en-SG,River Wonder,True
Cr_TH,5.0,It is a very good place to visit with our beloved person.,16/01/23,2,https://sg.trip.com/review/river-wonders-98700-174610967?locale=en-SG,River Wonder,True
jiahuuuuiii,5.0,impromtu trip with friends. managed to book tickets at a much lower rate as compared to other platform.,27/11/22,0,https://sg.trip.com/review/river-wonders-98700-173858412?locale=en-SG,River Wonder,True
ppeum,5.0,Humid and stuffy at times but worth it overall. Would come again when there&#39;s another huge event.,02/04/22,0,https://sg.trip.com/review/river-wonders-98700-171212373?locale=en-SG,River Wonder,True
Massimo90,5.0,Great place with a walking loop around and beautiful views. Early in the morning there is a definite direction to the path (we happened to be going the wrong way). No one seemed to be upset with us. Pre-6am lots of people exercising and doing in the park dancing workouts. Evenings on the weekends they close the street so everyone can walk in it.,17/07/23,0,https://sg.trip.com/review/river-wonders-98700-177629492?locale=en-SG,River Wonder,True
Deepandwide,3.0,most people visit river wonders to see the pandas. the other plus point is that it&rsquo;s fully covered. else you might find the place boring and limited as compared to the zoo.,12/03/23,0,https://sg.trip.com/review/river-wonders-98700-175160575?locale=en-SG,River Wonder,True
_TI***ly,5.0,thats sooooooo nice 😊,05/06/23,0,https://sg.trip.com/review/river-wonders-98700-176061235?locale=en-SG,River Wonder,True
Chenlilin,5.0,Smaller wildlife park can visit on the same day after visiting the zoo.,20/07/22,1,https://sg.trip.com/review/river-wonders-98700-171642736?locale=en-SG,River Wonder,True
Maxineeee,5.0,"very good place to see aquariums, such as sharks and crocodiles!!!",09/11/22,1,https://sg.trip.com/review/river-wonders-98700-173551118?locale=en-SG,River Wonder,True
KPriya2022,5.0,short ride with fun,24/08/22,3,https://sg.trip.com/review/river-wonders-98700-172321046?locale=en-SG,River Wonder,True
Mollylolly,5.0,"don&rsquo;t have to worry about wet weather, as there&rsquo;s quite a lot of indoor/ shelter area. suitable for family outing.",12/06/23,0,https://sg.trip.com/review/river-wonders-98700-176231532?locale=en-SG,River Wonder,True
lara69537,5.0,Such a pretty and beautiful day out wihh fronds and family. Would definitely come again,19/07/23,1,https://sg.trip.com/review/river-wonders-98700-177662690?locale=en-SG,River Wonder,True
Abil Hesmes,5.0,"it have many attraction here, let&#39;s come here with your family or friends or loved one",05/07/23,1,https://sg.trip.com/review/river-wonders-98700-177480912?locale=en-SG,River Wonder,True
Jeremy Chan Nomad,5.0,Probably one of the most integrated zoo around the world with amazing animals to view,24/06/23,1,https://sg.trip.com/review/river-wonders-98700-176791879?locale=en-SG,River Wonder,True
OMAR FAROUQE,5.0,It is amazing view in underwater aquarium.kids enjoy much in this place with family.,29/10/22,0,https://sg.trip.com/review/river-wonders-98700-173367851?locale=en-SG,River Wonder,True
sai Srujan,5.0,lot of aquarium fish and shark to see it and watch very big and must see these place,18/07/23,1,https://sg.trip.com/review/river-wonders-98700-177645511?locale=en-SG,River Wonder,True
pikachoo,5.0,"Great weekend at River Wonders, formerly River Safari.",05/10/22,1,https://sg.trip.com/review/river-wonders-98700-172981502?locale=en-SG,River Wonder,True
Fern2911,5.0,LOVE THE CHOCOLATE PAU HERE! super cute and also yummy!,07/08/22,1,https://sg.trip.com/review/river-wonders-98700-171990752?locale=en-SG,River Wonder,True
Yukio Hasegawa Artchork,5.0,The best freshwater aquarium in the world. You will find many large fish you have never seen before.,04/07/23,0,https://sg.trip.com/review/river-wonders-98700-177465620?locale=en-SG,River Wonder,True
YEW SING,5.0,So many fishes and underwater animals that l never seen before. So amazing,12/07/23,1,https://sg.trip.com/review/river-wonders-98700-177566275?locale=en-SG,River Wonder,True
_TX***5w,5.0,it was great. Very nice place hope to visit again.,23/12/22,1,https://sg.trip.com/review/river-wonders-98700-174286521?locale=en-SG,River Wonder,True
Hala Elhuseiny,5.0,it&rsquo;s amazing place I recommend it for everyone you will have amazing time,06/10/22,0,https://sg.trip.com/review/river-wonders-98700-173000090?locale=en-SG,River Wonder,True
Marian’s holidays,4.0,"What you can do in Singapore? Set aside three to four hours to explore the various zones. A few hours should be ample time to see everything in the aquatic park, even with the River Wonders show and boat ride in your itinerary.",17/07/23,1,https://sg.trip.com/review/river-wonders-98700-177629425?locale=en-SG,River Wonder,True
chawanmushis,4.0,"Lots of air-conditioned places, loved looking at the animals and fishes. Sign up early for the show! Kind of small compared to the Zoo and Bird Paradise.",03/07/23,1,https://sg.trip.com/review/river-wonders-98700-177434676?locale=en-SG,River Wonder,True
daniaexperiences,4.0,"Very interesting sea creatures to check out in different zones, many of them are quite huge. Restaurants available there inside if you&rsquo;re hungry.",14/06/23,1,https://sg.trip.com/review/river-wonders-98700-176245492?locale=en-SG,River Wonder,True
Aynsd,4.0,"a very exciting adventure to experience. the people are very nice and informative, the scenery are amazingly mesmerising, will definitely recommend people to visit this place",03/08/22,0,https://sg.trip.com/review/river-wonders-98700-171908129?locale=en-SG,River Wonder,True
