username,rating,content,time,image,UserURL,Attraction,is_english
Sneakerkicker,5.0,"Marina Bay Sands SkyPark is an iconic attraction located in Singapore that offers breathtaking views and a unique experience for visitors. As one of the most recognizable landmarks in the city, it is a must-visit destination for tourists and locals alike.The SkyPark is situated atop the three towering hotel buildings of Marina Bay Sands and features a stunning infinity pool, observation deck, restaurants, and lush gardens. The highlight of the SkyPark is undoubtedly the infinity pool, which offers an unparalleled view of the city&#39;s skyline. It&#39;s a truly remarkable experience to swim in the pool while enjoying panoramic views of Singapore&#39;s impressive architecture.The observation deck provides a 360-degree view of the city, allowing visitors to admire the urban landscape, including the famous Gardens by the Bay, the Singapore Flyer, and the bustling Marina Bay area. The vistas during both the day and night are simply breathtaking, and it&#39;s an ideal spot for photography enthusiasts.Apart from the views, Marina Bay Sands SkyPark also offers a selection of excellent dining options. Visitors can indulge in a variety of cuisines, ranging from international fare to local delights, while enjoying the luxurious ambiance and fantastic views.One thing to note is that the SkyPark can get quite crowded, especially during peak hours and weekends. It&#39;s advisable to plan your visit accordingly and book tickets in advance to avoid long queues. Additionally, access to the infinity pool is exclusive to hotel guests, so if you&#39;re not staying at Marina Bay Sands, you won&#39;t be able to take a dip in the pool.Overall, Marina Bay Sands SkyPark is an impressive attraction that offers an unforgettable experience with its stunning views, beautiful design, and vibrant atmosphere. Whether you&#39;re a tourist or a local resident, a visit to the SkyPark is definitely worth it for anyone seeking a unique perspective of Singapore&#39;s skyline.",22/11/23,3,https://sg.trip.com/review/sands-skypark-15131377-179866870?locale=en-SG,Skypark,True
Arsalll,5.0,Amazing view from the top of Marina Bay Sands Hotel. Go there at sunset and you will see the best of both daytime and nighttime views.,30/10/23,3,https://sg.trip.com/review/sands-skypark-15131377-179611408?locale=en-SG,Skypark,True
Ann ph,5.0,sands sky park gives  stunning view of Singapore especially the one of the world busiest seaport that fill with vessels!,26/10/23,3,https://sg.trip.com/review/sands-skypark-15131377-179544756?locale=en-SG,Skypark,True
Janicelcmow,5.0,"The Singapore Sky Garden is like a giant surfboard spanning the top of three hotels. In addition, the sky garden also has a public observation deck that can accommodate hundreds of people at the same time, where guests can enjoy spectacular views of the South China Sea, Marina Bay, and Singapore city. it&#39;s the best place to be when you are down and happy. The best place to chill 😁",25/10/23,3,https://sg.trip.com/review/sands-skypark-15131377-179532841?locale=en-SG,Skypark,True
NM Ching,5.0,"this place is located in Marina Bay sand, you can just buy the ticket and see the overview of SG",16/01/24,1,https://sg.trip.com/review/sands-skypark-15131377-180431844?locale=en-SG,Skypark,True
rayemeltz,5.0,can be very joyous and memorable. makw more friends and experience singapore like jo other,18/01/24,1,https://sg.trip.com/review/sands-skypark-15131377-180440369?locale=en-SG,Skypark,True
PabloSlab,5.0,Sands Skypark is absolutely incredible and breathtaking. would highly recommend going,23/01/24,1,https://sg.trip.com/review/sands-skypark-15131377-180499446?locale=en-SG,Skypark,True
NeilJ,5.0,Great views and lots of nice things to do. Will definitely come and visit this place again.,07/01/24,1,https://sg.trip.com/review/sands-skypark-15131377-180303960?locale=en-SG,Skypark,True
Seah Yong,5.0,This Skypark is the best place for catching the glimpse of fireworks during the night.,17/01/24,1,https://sg.trip.com/review/sands-skypark-15131377-180435609?locale=en-SG,Skypark,True
BoySaMoum,5.0,"Sands Skypark Observation Deck is a must-visit for anyone visiting Singapore. It offers stunning 360-degree views of the city skyline, the Marina Bay area, and the Singapore Strait. The observation deck is located on the 57th floor of the Marina Bay Sands hotel, and it is accessible by elevator from the hotel&#39;s lobby.To get to the Sands Skypark Observation Deck, you can either take a taxi or the MRT (metro) to the Bayfront station. From the station, it is a short walk to the Marina Bay Sands hotel. Once you are inside the hotel, follow the signs to the Sands Skypark Observation Deck.Tickets for the Sands Skypark Observation Deck can be purchased online or at the ticket counter on the 57th floor. The ticket price includes admission to the observation deck and a free drink.",29/10/23,2,https://sg.trip.com/review/sands-skypark-15131377-179607393?locale=en-SG,Skypark,True
Jason Kasrawi,5.0,Sands SkyPark - Sky-high vibes and breathtaking views. A must for anyone in Singapore! 🏙️ #SandsSkyPark,11/01/24,0,https://sg.trip.com/review/sands-skypark-15131377-180365630?locale=en-SG,Skypark,True
Bcn59123,5.0,this place is impressive ! you have an excellent view of Singapour and its suburbs!,04/01/24,1,https://sg.trip.com/review/sands-skypark-15131377-180291154?locale=en-SG,Skypark,True
Siungau,5.0,best view ever!!!!just take your loved one for a amazing day and enjoy it while you have a fantastic weekend,16/12/23,3,https://sg.trip.com/review/sands-skypark-15131377-180085026?locale=en-SG,Skypark,True
Ricardo The Traveller,5.0,great to experience solo or with family! best sunset to experience too Enjoy MBS!,16/01/24,1,https://sg.trip.com/review/sands-skypark-15131377-180428222?locale=en-SG,Skypark,True
zzrvhmvn,5.0,top place with amazing view. the heart of singapore. a must visit place. love it!,23/12/23,1,https://sg.trip.com/review/sands-skypark-15131377-180148332?locale=en-SG,Skypark,True
_TS***8h,5.0,beautiful- you can get frozen Singapore slings from the bar to cool you down while you soak in the views!,07/01/24,0,https://sg.trip.com/review/sands-skypark-15131377-180304535?locale=en-SG,Skypark,True
Khadijahzaki,5.0,Sands sky parkLocated at Singapore Attraction: enjoy sky view and sunset 🌅,19/12/23,1,https://sg.trip.com/review/sands-skypark-15131377-180127245?locale=en-SG,Skypark,True
Oppa Goldfish,5.0,Been here twice so far !!!!Really love the vibe 😊😊😊Excellent place and recommend you to visit :),22/01/24,0,https://sg.trip.com/review/sands-skypark-15131377-180492401?locale=en-SG,Skypark,True
Hazi K,5.0,Sands Sky Park Singapore 🇸🇬 the magnificent view in the middle of city and Night View is amazing 😻,17/01/24,0,https://sg.trip.com/review/sands-skypark-15131377-180434127?locale=en-SG,Skypark,True
Niques,5.0,"what a great view from the top, i love it very very much that i want to repeat it",14/01/24,1,https://sg.trip.com/review/sands-skypark-15131377-180389237?locale=en-SG,Skypark,True
Hackvio_Onyx,5.0,probably the best place to overlook Singapore&rsquo;s city sky line and sunset.,03/01/24,1,https://sg.trip.com/review/sands-skypark-15131377-180286621?locale=en-SG,Skypark,True
Arkar Moe,4.0,great view and atmosphere. You can see river or Garden By The Bay view. Visit on weekdays better.,22/01/24,2,https://sg.trip.com/review/sands-skypark-15131377-180491372?locale=en-SG,Skypark,True
Talha_arefa_quazi,3.0,"The view from the top is truly breathtaking, making this a must-visit location in Singapore. Went before 4:00pm on a weekday, didn&rsquo;t have to wait too long for the lift. From the birds eye view, an amazing area to get the 360&deg; view of entire Singapore from top. You almost get the view of all the major tourist places near marina.",19/01/24,3,https://sg.trip.com/review/sands-skypark-15131377-180447520?locale=en-SG,Skypark,True
Inspiretion,4.0,"Marina Bay Sands SkyPark is an architectural marvel perched atop Singapore&#39;s iconic hotel. Boasting breathtaking views of the city skyline and the bay, it offers a spectacular experience. The infinity pool, lush gardens, and vibrant atmosphere make it a must-visit destination, blending luxury and awe-inspiring panoramas seamlessly.",02/01/24,1,https://sg.trip.com/review/sands-skypark-15131377-180276873?locale=en-SG,Skypark,True
A L GO,4.0,"Visiting the Sands SkyPark was an extraordinary experience, offering breathtaking panoramic views of Singapore&#39;s skyline. Perched atop the iconic Marina Bay Sands, the SkyPark&#39;s observation deck allowed me to see the city from an unparalleled vantage point. The architectural marvel of the cantilevered platform, stretching over three towers, was a sight in itself. The lush gardens and the world-famous infinity pool added to the surreal atmosphere, providing a perfect backdrop for photos. The vibe was serene, yet lively, with visitors from all around the world soaking in the scenery. Although the entry fee was on the pricier side, the unique experience and stunning views were well worth it, making Sands SkyPark a must-visit destination in Singapore.",25/12/23,1,https://sg.trip.com/review/sands-skypark-15131377-180189909?locale=en-SG,Skypark,True
Jun UKVI,5.0,"Sands SkyPark in Singapore is a dazzling marvel perched atop the iconic Marina Bay Sands. The rooftop oasis boasts breathtaking panoramic views of the city skyline and the Marina Bay. The infinity pool, suspended 57 stories high, provides a surreal experience, making it one of the world&#39;s most renowned poolside settings.The SkyPark isn&#39;t just about the views; it offers an array of dining options, lush gardens, and a sense of luxury that defines the Marina Bay Sands experience. From sunset vistas to the vibrant city lights, Sands SkyPark is a testament to Singapore&#39;s architectural splendor and a must-visit for those craving a sky-high escape in the heart of the city.",15/12/23,2,https://sg.trip.com/review/sands-skypark-15131377-180079383?locale=en-SG,Skypark,True
_TI***b7,5.0,Purchase the tickets at Level 1 @ Tower 3. $22/person. Took the lift up to 56 floors. Exit the lift there is a small open area for picture taking before going into the restaurant. It was a week day and the crowd was small. Able to get a seat right by the window. Order some drinks and snacks and was able to use the ticket price as credit for the bill. The view was fantastic. We also can see the pool and the hotel guest taking their swim. Spent about an hour and a half up there and took lots of pictures. Great trip.,14/12/23,2,https://sg.trip.com/review/sands-skypark-15131377-180075703?locale=en-SG,Skypark,True
allyshlby,5.0,"Visiting the Sand SkyPark was an unforgettable experience that left me in awe. The stunning architecture seamlessly blends with the panoramic views, creating a breathtaking spectacle. The attention to detail in the design and layout is impeccable. The SkyPark offers a perfect vantage point to appreciate the cityscape, and the surrounding landscapes. The atmosphere is serene, providing a welcome escape from the hustle and bustle below. The facilities and amenities are top-notch, ensuring a comfortable and enjoyable visit. Whether you&#39;re a tourist or a local, the Sand SkyPark is a must-visit destination, offering a perfect blend of luxury and natural beauty.",02/12/23,2,https://sg.trip.com/review/sands-skypark-15131377-179957281?locale=en-SG,Skypark,True
Ingyinn,5.0,"Take your enjoyment to greater heights at the SkyPark Observation Deck. 56 storeys up, in the heart of the Marina Bay Area, this scenic view of Singapore&#39;s ...",30/11/23,2,https://sg.trip.com/review/sands-skypark-15131377-179946565?locale=en-SG,Skypark,True
liliyeoh,5.0,57 levels above the grounds.  a visit to the Skypark&rsquo;s observation Dexk is a must for anyone looking to get the best view of the city&rsquo;s gorgeous skyline,24/11/23,2,https://sg.trip.com/review/sands-skypark-15131377-179872929?locale=en-SG,Skypark,True
Japonamama,5.0,"Sands SkyPark refers to the iconic rooftop park situated atop the Marina Bay Sands resort in Singapore. Offering breathtaking panoramic views of the city skyline, the SkyPark features a stunning infinity pool, observation deck, lush gardens, and restaurants. It has become a symbol of Singapore&#39;s modern architectural landscape, providing visitors with a unique and memorable experience high above the city. The SkyPark is especially renowned for its spectacular views, making it a must-visit attraction for those exploring Singapore.",22/11/23,2,https://sg.trip.com/review/sands-skypark-15131377-179866750?locale=en-SG,Skypark,True
Axell,5.0,Went up the Skypark using the lift. It was really windy and had a really high open view of Singapore. Felt really great to be able to see Singapore from such high point of view. Amazing :),18/11/23,2,https://sg.trip.com/review/sands-skypark-15131377-179809677?locale=en-SG,Skypark,True
ONG YAO HUI,5.0,"Stunning views of the buzzing city of Singapore&#39;s Central Business District at the top of Singapore prestigious Shopping mall, The Marina Bay Sands by Sands organization. Lovely",15/11/23,2,https://sg.trip.com/review/sands-skypark-15131377-179793843?locale=en-SG,Skypark,True
_TI***sc,5.0,Throwback to when i went to Singapore and stayed in the marinabaysands hotel. I&#39;d have been dying to swim in their infinity pool on the 57th floor. LOVED sands skypark! #mbshotel #singapore #infinitypool #fypシ will visit again,15/11/23,2,https://sg.trip.com/review/sands-skypark-15131377-179792577?locale=en-SG,Skypark,True
Zachariah Koo,5.0,go there at night is very nice  but too many people there so kind of very hot and staffed so when there&rsquo;s for a short while and also I bring my baby is not really enjoying,09/11/23,2,https://sg.trip.com/review/sands-skypark-15131377-179718888?locale=en-SG,Skypark,True
Sandesh Ghale,5.0,It&rsquo;s one of the best places to see the panoramic breath-taking view from Marina Bay&rsquo;s SkyPark Observation Deck along with other beautiful landmarks in the country.,05/11/23,2,https://sg.trip.com/review/sands-skypark-15131377-179654180?locale=en-SG,Skypark,True
IsabelleRuth,5.0,"Great view of Singapore from on high. Would be back again. The pool looks incredible, you can see an ask round view of Singapore.",05/11/23,2,https://sg.trip.com/review/sands-skypark-15131377-179654013?locale=en-SG,Skypark,True
Chiko merico,5.0,"A must-visit spot when in Singapore. There is a discount for showing your Singapore Airlines boarding pass, which is not bad. From this SkyPark you can see metropolitan Singapore from above, including the Garden By The Bay building and the Art Science Museum, which when viewed from above resemble flowers. So instagrammable",02/11/23,2,https://sg.trip.com/review/sands-skypark-15131377-179630386?locale=en-SG,Skypark,True
Amy227,5.0,"Sands SkyPark, perched atop Marina Bay Sands in Singapore, is an architectural marvel and a haven for luxury enthusiasts. Its iconic infinity pool offers panoramic views of the city&#39;s skyline, creating a surreal experience. With world-class dining, upscale lounges, and breathtaking vistas, Sands SkyPark exemplifies sophistication, making it a must-visit destination for travelers seeking opulence and breathtaking scenery.",22/10/23,2,https://sg.trip.com/review/sands-skypark-15131377-179508938?locale=en-SG,Skypark,True
Anky in Europe,5.0,Singapore is a definite good place to visit and you can see the whole view of Singapore through the sands sky park. I have been there in the night time and it was amazing!,05/10/23,5,https://sg.trip.com/review/sands-skypark-15131377-179268991?locale=en-SG,Skypark,True
ZZyun516,5.0,Beautiful views from the top. We attempted to go in the evening before the light show but the lines were huge. So we came on the next day morning and We enjoyed the views at daytime a lot！,22/09/23,9,https://sg.trip.com/review/sands-skypark-15131377-179072399?locale=en-SG,Skypark,True
JQ$$$,5.0,awesome dinner at marina bay sands! marvelous seaview with perfect dining experience. don&#39;t miss out when u are here at marina bay sands!,08/09/23,5,https://sg.trip.com/review/sands-skypark-15131377-178869175?locale=en-SG,Skypark,True
Jess Oh Pa,5.0,"We only manage to get to Fullerton Sq, looking from the opposite of Sand Skypark and manage to get visit the of iconic symbol of Singapore: The Merlion.. it was really a great experience... observing the surrounding with a cup of coffee and burger snacks... this moment was truly enjoyable..",04/09/23,5,https://sg.trip.com/review/sands-skypark-15131377-178831708?locale=en-SG,Skypark,True
Cappuccino Mocca,5.0,Really a birds eye view from the 57th level. It&#39;s our first time over here. We have enjoyed ourselves very much. Loving the beautiful scenic views of Sunset and night views too. It&#39;s worth heading over there. A nice place to chill out.,21/08/23,9,https://sg.trip.com/review/sands-skypark-15131377-178535813?locale=en-SG,Skypark,True
Kyasti,5.0,you get an amazing view from here .. so always wanted to be in Singapore I don&rsquo;t know when I will start living in this Lion city,30/07/23,6,https://sg.trip.com/review/sands-skypark-15131377-177807476?locale=en-SG,Skypark,True
crystalhavingacrisis,5.0,"great view, however can be too crowded at times with many tourists, try to go earlier in the day!",25/12/23,0,https://sg.trip.com/review/sands-skypark-15131377-180191213?locale=en-SG,Skypark,True
_TI***3i,5.0,Really Amazing views. As a first timer it is really worth it and so happy to bring my family here,06/01/24,0,https://sg.trip.com/review/sands-skypark-15131377-180301634?locale=en-SG,Skypark,True
Nokuro,5.0,i will surely cone back again some other day to visit here.  Love it very much. Come visit here.,30/12/23,0,https://sg.trip.com/review/sands-skypark-15131377-180226064?locale=en-SG,Skypark,True
_TI***w3,5.0,"excelent its a really awsome nice one , truely good its a excelent cool , awsome nice view wow",13/01/24,0,https://sg.trip.com/review/sands-skypark-15131377-180374906?locale=en-SG,Skypark,True
_TS***4j,5.0,visited in Feb last year beautiful weather and amazing scenery makes it worth your while!,23/01/24,0,https://sg.trip.com/review/sands-skypark-15131377-180498396?locale=en-SG,Skypark,True
Raju Ahmed raj fast boye raju.,5.0,"nice palece, very good palece.i love this palece.i want many time holiday tur this palece",05/01/24,0,https://sg.trip.com/review/sands-skypark-15131377-180297283?locale=en-SG,Skypark,True
_TT***89,5.0,"Best observatory in Singapore , see all the important buildings and monuments from here",04/01/24,0,https://sg.trip.com/review/sands-skypark-15131377-180291192?locale=en-SG,Skypark,True
ZinniaC,5.0,the view is amazinggggg from the top. basically you see the overview of the sea! i love it,04/01/24,0,https://sg.trip.com/review/sands-skypark-15131377-180289941?locale=en-SG,Skypark,True
_TI***s4,5.0,"singapore sand skypark is nice to visit...i been here longtime ago, this place is amazing...",11/10/23,9,https://sg.trip.com/review/sands-skypark-15131377-179353771?locale=en-SG,Skypark,True
memoloa,4.0,"Sands Skypark is most recommended attraction on Singapore, you can see all above the city from deck sky!",24/01/24,1,https://sg.trip.com/review/sands-skypark-15131377-180501071?locale=en-SG,Skypark,True
_TI***ny,5.0,Excellent day out with the family&hellip;you will not find anything like this in Europe,22/01/24,0,https://sg.trip.com/review/sands-skypark-15131377-180490024?locale=en-SG,Skypark,True
Ric27,5.0,you can have a nice scenic view with clear view of Singapore without any blockage,17/01/24,0,https://sg.trip.com/review/sands-skypark-15131377-180432984?locale=en-SG,Skypark,True
Medic Tony,5.0,place was nice. beautiful place. nice scenery. nice environment. cool breeze.,25/12/23,0,https://sg.trip.com/review/sands-skypark-15131377-180188476?locale=en-SG,Skypark,True
Ayeshie,5.0,it&rsquo;s a very nice place for social media influencers to  make nice content and take excellent pictures.,13/09/23,9,https://sg.trip.com/review/sands-skypark-15131377-178969824?locale=en-SG,Skypark,True
Mallic,5.0,Me and my family enjoy being here. And if we get a chance we come back next year.,20/12/23,0,https://sg.trip.com/review/sands-skypark-15131377-180130369?locale=en-SG,Skypark,True
VoyageRanger,5.0,Best location to admire Singapore&rsquo;s cityscape day and night! Worth visit.,20/11/23,3,https://sg.trip.com/review/sands-skypark-15131377-179854447?locale=en-SG,Skypark,True
Lakwachero,5.0,"so relaxing and stunning beauty,keep sharing to my friends and family too",01/01/24,0,https://sg.trip.com/review/sands-skypark-15131377-180270414?locale=en-SG,Skypark,True
_TI***mi,5.0,omg is this magical nice and amazing good job on taking this photo amazing,25/12/23,0,https://sg.trip.com/review/sands-skypark-15131377-180189040?locale=en-SG,Skypark,True
THIM LANDY,5.0,sands sky park so amazing place to visit y&rsquo;all please come and get more fun,28/10/23,3,https://sg.trip.com/review/sands-skypark-15131377-179557196?locale=en-SG,Skypark,True
Amanda Mona,5.0,that&rsquo;s amazing place and I would love to go back for visit again 👏🏻👏🏻,12/01/24,0,https://sg.trip.com/review/sands-skypark-15131377-180366908?locale=en-SG,Skypark,True
Sreykim Ren,4.0,beautiful landmark and great vibes! always attracted the eyes of people who gone up to see the whole landscape of Singapore!,03/01/24,0,https://sg.trip.com/review/sands-skypark-15131377-180284259?locale=en-SG,Skypark,True
_TI***k2,5.0,Had a wonderful time here with family will definitely return here again,28/12/23,0,https://sg.trip.com/review/sands-skypark-15131377-180214938?locale=en-SG,Skypark,True
Addat,3.0,Great views but not much to do once you&rsquo;re up there other than look at people in a swimming pool. Better to book a reservation at a bar and go for free!,20/12/23,2,https://sg.trip.com/review/sands-skypark-15131377-180130347?locale=en-SG,Skypark,True
Daniela Zapata soro,5.0,best views &hellip;  I love it people is so friendly and they have amazing food and cocktails also there ! I&rsquo;ll definitely go back . worth it !,18/12/23,1,https://sg.trip.com/review/sands-skypark-15131377-180122069?locale=en-SG,Skypark,True
Amin4ar,5.0,"Sands SkyPark offers an awe-inspiring escape above Singapore&#39;s skyline. The panoramic views from the iconic rooftop are breathtaking, especially during sunset when the city transforms into a sea of lights. The infinity pool&#39;s edge seemingly merges with the sky, creating a surreal experience. A visit to Sands SkyPark is a captivating journey, revealing the city&#39;s beauty from new heights.",17/12/23,1,https://sg.trip.com/review/sands-skypark-15131377-180090751?locale=en-SG,Skypark,True
Safaa Maretha,5.0,"The hotel&#39;s observation deck on the 57th floor offers panoramic city views &amp; 2 fine restaurants.  Nice view, with appropriate food and drinks.  However, you have to queue quite a long time to get a place.  From this SkyPark you can see metropolitan Singapore from above, including the Garden By The Bay building and the Art Science Museum, which when viewed from above resemble flowers.",13/12/23,1,https://sg.trip.com/review/sands-skypark-15131377-180071069?locale=en-SG,Skypark,True
wxxyxx,5.0,chill place~ able to see the gardens by the bay as well! recommended to visit at evening time because able to watch sunset,12/12/23,1,https://sg.trip.com/review/sands-skypark-15131377-180064491?locale=en-SG,Skypark,True
Jim Chng,5.0,"Marina Bay Sands SkyPark offers a breathtaking panoramic view of Singapore&#39;s skyline. Perched atop the iconic hotel, the infinity pool steals the show, providing an unparalleled experience. While the observation deck offers stunning vistas, the pool, surrounded by cityscapes, elevates the visit to a luxurious escape. Despite being a tourist hotspot, the SkyPark delivers a memorable, must-see experience for its remarkable views and architectural marvel.",09/12/23,1,https://sg.trip.com/review/sands-skypark-15131377-180017004?locale=en-SG,Skypark,True
Princess N,4.0,I went up for free as I was staying at the hotel. You can see the whole Singapore from the top of MBS. Should go at least once to feel like you actually reached Singapore properly.,03/12/23,3,https://sg.trip.com/review/sands-skypark-15131377-179992257?locale=en-SG,Skypark,True
MunHong,5.0,The Singapore CBD night view is amazing and especially to view it from this Sands SkyPark. You can have almost 360 degree view without any blocking. It&rsquo;s really worth for your time to travel and experience this great place.,01/12/23,1,https://sg.trip.com/review/sands-skypark-15131377-179949944?locale=en-SG,Skypark,True
Lesley Chin,5.0,"Sands SkyPark is an iconic rooftop park atop Marina Bay Sands in Singapore, providing breathtaking panoramic views of the city skyline. It features a stunning infinity pool, observation deck, and lush gardens, making it a must-visit destination for both guests and visitors.",30/11/23,1,https://sg.trip.com/review/sands-skypark-15131377-179946455?locale=en-SG,Skypark,True
cindy0604,5.0,"✨ Sands Skypark is a dazzling experience! The breathtaking views from the rooftop, infinity pool, and world-class dining options make it a must-visit destination in Singapore. 🏙️🌆 #SandsSkypark #SkyHighLuxury",30/11/23,1,https://sg.trip.com/review/sands-skypark-15131377-179945035?locale=en-SG,Skypark,True
The Pinky,5.0,"Let your guests enjoy a spectacular 360-degree view of Singapore from 56 storeys above while sipping cocktails and enjoying live entertainment. Sands SkyPark is the perfect place to take in the gorgeous sunset, and marvel at the illumination of the city skyline and Gardens by the Bay at night as you party till late under the stars.",26/11/23,1,https://sg.trip.com/review/sands-skypark-15131377-179882938?locale=en-SG,Skypark,True
